xPDUBranchCurrentMaxAlarm;.1.3.6.1.4.1.318.0.628;Energia;2;Normal;Branch circuit current is above threshold.;;;;;;;;;;;;;;;;;;;;;;;
xPDUBranchCurrentMaxAlarmCleared;.1.3.6.1.4.1.318.0.629;Energia;2;Normal;Branch circuit high current alarm cleared.;;;;;;;;;;;;;;;;;;;;;;;
rPDUOutletLowLoad;.1.3.6.1.4.1.318.0.630;Energia;2;Warning;A Rack PDU has violated the outlet low load threshold.;;;;;;;;;;;;;;;;;;;;;;;
rPDUOutletLowLoadCleared;.1.3.6.1.4.1.318.0.631;Energia;2;Normal;The low load condition on a Rack PDU has been cleared.;;;;;;;;;;;;;;;;;;;;;;;
rPDUOutletNearOverload;.1.3.6.1.4.1.318.0.632;Energia;2;Warning;A Rack PDU is near an outlet overload condition.;;;;;;;;;;;;;;;;;;;;;;;
rPDUOutletNearOverloadCleared;.1.3.6.1.4.1.318.0.633;Energia;2;Normal;Rack PDU outlet near overload condition has cleared.;;;;;;;;;;;;;;;;;;;;;;;
rPDUOutletOverload;.1.3.6.1.4.1.318.0.634;Energia;2;Normal;A Rack PDU is in an outlet overload condition.;;;;;;;;;;;;;;;;;;;;;;;
rPDUOutletOverloadCleared;.1.3.6.1.4.1.318.0.635;Energia;2;Normal;The outlet overload condition on a Rack PDU has cleared.;;;;;;;;;;;;;;;;;;;;;;;
apcTestTrap;.1.3.6.1.4.1.318.0.636;Energia;2;Normal;Test Trap.;;;;;;;;;;;;;;;;;;;;;;;
baseFanFailureCleared;.1.3.6.1.4.1.318.0.637;Energia;2;Normal;The base module fan has been repaired.;;;;;;;;;;;;;;;;;;;;;;;
atsLowLoad;.1.3.6.1.4.1.318.0.638;LOGONLY;2;Warning;ATS has violated the bank or phase low load threshold.;;;;;;;;;;;;;;;;;;;;;;;
atsLowLoadCleared;.1.3.6.1.4.1.318.0.639;LOGONLY;2;Normal;The low load condition on an ATS has been cleared.;;;;;;;;;;;;;;;;;;;;;;;
atsNearOverload;.1.3.6.1.4.1.318.0.640;LOGONLY;2;Warning;ATS is near a bank or phase overload condition.;;;;;;;;;;;;;;;;;;;;;;;
atsNearOverloadCleared;.1.3.6.1.4.1.318.0.641;LOGONLY;2;Normal;ATS bank or phase near overload condition has cleared.;;;;;;;;;;;;;;;;;;;;;;;
atsOverload;.1.3.6.1.4.1.318.0.642;LOGONLY;2;Normal;ATS is in overload condition.;;;;;;;;;;;;;;;;;;;;;;;
atsOverloadCleared;.1.3.6.1.4.1.318.0.643;LOGONLY;2;Normal;The bank or phase overload condition on an ATS has cleared.;;;;;;;;;;;;;;;;;;;;;;;
atsRMSOverVoltage;.1.3.6.1.4.1.318.0.644;LOGONLY;2;Normal;Overvoltage condition violated.;;;;;;;;;;;;;;;;;;;;;;;
atsRMSOverVoltageCleared;.1.3.6.1.4.1.318.0.645;LOGONLY;2;Normal;Overvoltage condition cleared.;;;;;;;;;;;;;;;;;;;;;;;
atsRMSUnderVoltage;.1.3.6.1.4.1.318.0.646;LOGONLY;2;Normal;Undervoltage condition violated.;;;;;;;;;;;;;;;;;;;;;;;
atsRMSUnderVoltageCleared;.1.3.6.1.4.1.318.0.647;LOGONLY;2;Normal;Undervoltage condition cleared.;;;;;;;;;;;;;;;;;;;;;;;
atsRMSOverFrequency;.1.3.6.1.4.1.318.0.648;LOGONLY;2;Normal;OverFrequency condition violated.;;;;;;;;;;;;;;;;;;;;;;;
atsRMSOverFrequencyCleared;.1.3.6.1.4.1.318.0.649;LOGONLY;2;Normal;OverFrequency condition cleared.;;;;;;;;;;;;;;;;;;;;;;;
atsRMSUnderFrequency;.1.3.6.1.4.1.318.0.650;LOGONLY;2;Normal;UnderFrequency condition violated.;;;;;;;;;;;;;;;;;;;;;;;
atsRMSUnderFrequencyCleared;.1.3.6.1.4.1.318.0.651;LOGONLY;2;Normal;UnderFrequency condition cleared.;;;;;;;;;;;;;;;;;;;;;;;
isxModularDistributionCommLost;.1.3.6.1.4.1.318.0.652;Energia;2;Normal;Modular distribution communication lost.;;;;;;;;;;;;;;;;;;;;;;;
isxModularDistributionCommEstablished;.1.3.6.1.4.1.318.0.653;Energia;2;Normal;Modular distribution communication restored.;;;;;;;;;;;;;;;;;;;;;;;
isxModularDistributionModuleInserted;.1.3.6.1.4.1.318.0.654;Energia;2;Normal;Distribution module inserted.;;;;;;;;;;;;;;;;;;;;;;;
isxModularDistributionModuleRemoved;.1.3.6.1.4.1.318.0.655;Energia;2;Normal;Distribution module removed.;;;;;;;;;;;;;;;;;;;;;;;
isxModularBreakerOpenAlarm;.1.3.6.1.4.1.318.0.656;Energia;2;Normal;Distribution breaker open alarm.;;;;;;;;;;;;;;;;;;;;;;;
isxModularBreakerOpenAlarmCleared;.1.3.6.1.4.1.318.0.657;Energia;2;Normal;Distribution breaker open alarm cleared.;;;;;;;;;;;;;;;;;;;;;;;
isxModularMinCurrentThresholdViolation;.1.3.6.1.4.1.318.0.658;Energia;2;Normal;Distribution current is below the critical threshold.;;;;;;;;;;;;;;;;;;;;;;;
isxModularMinCurrentThresholdViolationCleared;.1.3.6.1.4.1.318.0.659;Energia;2;Normal;Distribution current no longer below the critical threshold.;;;;;;;;;;;;;;;;;;;;;;;
isxModularLowCurrentThresholdViolation;.1.3.6.1.4.1.318.0.660;Energia;2;Warning;Distribution current is below the warning threshold.;;;;;;;;;;;;;;;;;;;;;;;
isxModularLowCurrentThresholdViolationCleared;.1.3.6.1.4.1.318.0.661;Energia;2;Normal;Distribution current no longer below the warning threshold.;;;;;;;;;;;;;;;;;;;;;;;
isxModularHighCurrentThresholdViolation;.1.3.6.1.4.1.318.0.662;Energia;2;Warning;Distribution current is above the warning threshold.;;;;;;;;;;;;;;;;;;;;;;;
isxModularHighCurrentThresholdViolationCleared;.1.3.6.1.4.1.318.0.663;Energia;2;Normal;Distribution current no longer above the warning threshold.;;;;;;;;;;;;;;;;;;;;;;;
isxModularMaxCurrentThresholdViolation;.1.3.6.1.4.1.318.0.664;Energia;2;Normal;Distribution current is above the critical threshold.;;;;;;;;;;;;;;;;;;;;;;;
isxModularMaxCurrentThresholdViolationCleared;.1.3.6.1.4.1.318.0.665;Energia;2;Normal;Distribution current no longer above the critical threshold.;;;;;;;;;;;;;;;;;;;;;;;
isxModularSubfeedBreakerOpenAlarm;.1.3.6.1.4.1.318.0.666;Energia;2;Normal;Distribution subfeed breaker open alarm.;;;;;;;;;;;;;;;;;;;;;;;
isxModularSubfeedBreakerOpenAlarmCleared;.1.3.6.1.4.1.318.0.667;Energia;2;Normal;Distribution subfeed breaker open alarm cleared.;;;;;;;;;;;;;;;;;;;;;;;
isxModularSubfeedMinCurrentThresholdViolation;.1.3.6.1.4.1.318.0.668;Energia;2;Normal;Distribution subfeed current is below the critical threshold.;;;;;;;;;;;;;;;;;;;;;;;
isxModularSubfeedMinCurrentThresholdViolationCleared;.1.3.6.1.4.1.318.0.669;Energia;2;Normal;Distribution subfeed current no longer below the critical threshold.;;;;;;;;;;;;;;;;;;;;;;;
isxModularSubfeedLowCurrentThresholdViolation;.1.3.6.1.4.1.318.0.670;Energia;2;Warning;Distribution subfeed current is below the warning threshold.;;;;;;;;;;;;;;;;;;;;;;;
isxModularSubfeedLowCurrentThresholdViolationCleared;.1.3.6.1.4.1.318.0.671;Energia;2;Normal;Distribution subfeed current is no longer below the warning threshold.;;;;;;;;;;;;;;;;;;;;;;;
isxModularSubfeedHighCurrentThresholdViolation;.1.3.6.1.4.1.318.0.672;Energia;2;Warning;Distribution subfeed current is above the warning threshold.;;;;;;;;;;;;;;;;;;;;;;;
isxModularSubfeedHighCurrentThresholdViolationCleared;.1.3.6.1.4.1.318.0.673;Energia;2;Normal;Distribution subfeed current no longer above the warning threshold.;;;;;;;;;;;;;;;;;;;;;;;
isxModularSubfeedMaxCurrentThresholdViolation;.1.3.6.1.4.1.318.0.674;Energia;2;Normal;Distribution subfeed current is above the critical threshold.;;;;;;;;;;;;;;;;;;;;;;;
isxModularSubfeedMaxCurrentThresholdViolationCleared;.1.3.6.1.4.1.318.0.675;Energia;2;Normal;Distribution subfeed current no longer above the critical threshold.;;;;;;;;;;;;;;;;;;;;;;;
isxModularTotalOutputCurrentMinThresholdViolation;.1.3.6.1.4.1.318.0.676;Energia;2;Normal;Distribution total current is below the critical threshold.;;;;;;;;;;;;;;;;;;;;;;;
isxModularTotalOutputCurrentMinThresholdViolationCleared;.1.3.6.1.4.1.318.0.677;Energia;2;Normal;Distribution total current no longer below the critical threshold.;;;;;;;;;;;;;;;;;;;;;;;
isxModularTotalOutputCurrentLowThresholdViolation;.1.3.6.1.4.1.318.0.678;Energia;2;Warning;Distribution total current is below the warning threshold.;;;;;;;;;;;;;;;;;;;;;;;
isxModularTotalOutputCurrentLowThresholdViolationCleared;.1.3.6.1.4.1.318.0.679;Energia;2;Normal;Distribution total current no longer below the warning threshold.;;;;;;;;;;;;;;;;;;;;;;;
isxModularTotalOutputCurrentHighThresholdViolation;.1.3.6.1.4.1.318.0.680;Energia;2;Warning;Distribution total current is above the warning threshold.;;;;;;;;;;;;;;;;;;;;;;;
isxModularTotalOutputCurrentHighThresholdViolationCleared;.1.3.6.1.4.1.318.0.681;Energia;2;Normal;Distribution total current no longer above the warning threshold.;;;;;;;;;;;;;;;;;;;;;;;
isxModularTotalOutputCurrentMaxThresholdViolation;.1.3.6.1.4.1.318.0.682;Energia;2;Normal;Distribution total current is above the critical threshold.;;;;;;;;;;;;;;;;;;;;;;;
isxModularTotalOutputCurrentMaxThresholdViolationCleared;.1.3.6.1.4.1.318.0.683;Energia;2;Normal;Distribution total current no longer above the critical threshold.;;;;;;;;;;;;;;;;;;;;;;;
isxModularOutputVoltageMinThresholdViolation;.1.3.6.1.4.1.318.0.684;Energia;2;Normal;Distribution output voltage is below the critical threshold.;;;;;;;;;;;;;;;;;;;;;;;
isxModularOutputVoltageMinThresholdViolationCleared;.1.3.6.1.4.1.318.0.685;Energia;2;Normal;Distribution output voltage no longer below the critical threshold.;;;;;;;;;;;;;;;;;;;;;;;
isxModularOutputVoltageLowThresholdViolation;.1.3.6.1.4.1.318.0.686;Energia;2;Warning;Distribution output voltage is below the warning threshold.;;;;;;;;;;;;;;;;;;;;;;;
isxModularOutputVoltageLowThresholdViolationCleared;.1.3.6.1.4.1.318.0.687;Energia;2;Normal;Distribution output voltage no longer below the warning threshold.;;;;;;;;;;;;;;;;;;;;;;;
isxModularOutputVoltageHighThresholdViolation;.1.3.6.1.4.1.318.0.688;Energia;2;Warning;Distribution output voltage is above the warning threshold.;;;;;;;;;;;;;;;;;;;;;;;
isxModularOutputVoltageHighThresholdViolationCleared;.1.3.6.1.4.1.318.0.689;Energia;2;Normal;Distribution output voltage no longer above the warning threshold.;;;;;;;;;;;;;;;;;;;;;;;
isxModularOutputVoltageMaxThresholdViolation;.1.3.6.1.4.1.318.0.690;Energia;2;Normal;Distribution output voltage is above the critical threshold.;;;;;;;;;;;;;;;;;;;;;;;
isxModularOutputVoltageMaxThresholdViolationCleared;.1.3.6.1.4.1.318.0.691;Energia;2;Normal;Distribution output voltage no longer above the critical threshold.;;;;;;;;;;;;;;;;;;;;;;;
apcDoorClosedImproperly;.1.3.6.1.4.1.318.0.692;Energia;2;Normal;Door closed improperly.;;;;;;;;;;;;;;;;;;;;;;;
apcDoorClosedImproperlyCleared;.1.3.6.1.4.1.318.0.693;Energia;2;Normal;Door no longer closed improperly.;;;;;;;;;;;;;;;;;;;;;;;
apcUserScheduleViolation;.1.3.6.1.4.1.318.0.694;Energia;2;Normal;User schedule violated.;;;;;;;;;;;;;;;;;;;;;;;
apcUserScheduleViolationCleared;.1.3.6.1.4.1.318.0.695;Energia;2;Normal;User schedule violation cleared.;;;;;;;;;;;;;;;;;;;;;;;
isxModularOutputFrequencyThresholdViolation;.1.3.6.1.4.1.318.0.696;Energia;2;Normal;Distribution output frequency out of range.;;;;;;;;;;;;;;;;;;;;;;;
isxModularOutputFrequencyViolationCleared;.1.3.6.1.4.1.318.0.697;Energia;2;Normal;Distribution output frequency no longer out of range.;;;;;;;;;;;;;;;;;;;;;;;
atsSourceStatusFail;.1.3.6.1.4.1.318.0.698;Energia;2;Normal;ATS Source failed.;;;;;;;;;;;;;;;;;;;;;;;
atsSourceStatusOk;.1.3.6.1.4.1.318.0.699;Energia;2;Normal;ATS Source OK.;;;;;;;;;;;;;;;;;;;;;;;
atsHardwareStatusFail;.1.3.6.1.4.1.318.0.700;Energia;2;Normal;ATS display board hardware failed.;;;;;;;;;;;;;;;;;;;;;;;
atsHardwareStatusOk;.1.3.6.1.4.1.318.0.701;Energia;2;Normal;ATS display board hardware ok.;;;;;;;;;;;;;;;;;;;;;;;
atsControllerRestart;.1.3.6.1.4.1.318.0.702;Energia;2;Normal;ATS Controller restarted.;;;;;;;;;;;;;;;;;;;;;;;
xATSS1BadPhaseRotation;.1.3.6.1.4.1.318.0.724;Energia;2;Normal;Phase rotation on source 1 is bad.;;;;;;;;;;;;;;;;;;;;;;;
xATSS1BadPhaseRotationCleared;.1.3.6.1.4.1.318.0.725;Energia;2;Normal;S1 phase rotation back to normal.;;;;;;;;;;;;;;;;;;;;;;;
xATSS1BadPhaseBalance;.1.3.6.1.4.1.318.0.726;Energia;2;Normal;Phase imbalance on source 1 exceeds threshold.;;;;;;;;;;;;;;;;;;;;;;;
xATSS1BadPhaseBalanceCleared;.1.3.6.1.4.1.318.0.727;Energia;2;Normal;S1 phase balance back to normal.;;;;;;;;;;;;;;;;;;;;;;;
isxModularTransformerOverheating;.1.3.6.1.4.1.318.0.728;Energia;2;Normal;Distribution transformer temperature is too hot.;;;;;;;;;;;;;;;;;;;;;;;
isxModularTransformerOverheatingCleared;.1.3.6.1.4.1.318.0.729;Energia;2;Normal;Distribution transformer temperature has returned to normal.;;;;;;;;;;;;;;;;;;;;;;;
apcInternalCommunicationFault;.1.3.6.1.4.1.318.0.730;Energia;2;Normal;An internal UPS communication fault exists.;;;;;;;;;;;;;;;;;;;;;;;
apcInternalCommunicationFaultCleared;.1.3.6.1.4.1.318.0.731;Energia;2;Normal;An internal UPS communication fault no longer exists.;;;;;;;;;;;;;;;;;;;;;;;
upsOutletGroupCommand;.1.3.6.1.4.1.318.0.732;LOGONLY;2;Warning;Outlet Group command issued.;;;;;;;;;;;;;;;;;;;;;;;
onbatterycommunicationLost;.1.3.6.1.4.1.318.0.733;LOGONLY;2;Normal;Communication lost between the agent and the UPS when UPS is on Battery.;;;;;;;;;;;;;;;;;;;;;;;
upsCriticalCondition;.1.3.6.1.4.1.318.0.734;LOGONLY;2;Normal;A critical condition has been detected.;;;;;;;;;;;;;;;;;;;;;;;
upsCriticalConditionCleared;.1.3.6.1.4.1.318.0.735;LOGONLY;2;Normal;A critical condition has been cleared.;;;;;;;;;;;;;;;;;;;;;;;
upsWarningCondition;.1.3.6.1.4.1.318.0.736;LOGONLY;2;Warning;A warning condition has been detected.;;;;;;;;;;;;;;;;;;;;;;;
upsWarningConditionCleared;.1.3.6.1.4.1.318.0.737;LOGONLY;2;Normal;A warning condition has been cleared.;;;;;;;;;;;;;;;;;;;;;;;
upsInformationalCondition;.1.3.6.1.4.1.318.0.738;LOGONLY;2;Normal;An informational condition has been detected.;;;;;;;;;;;;;;;;;;;;;;;
upsInformationalConditionCleared;.1.3.6.1.4.1.318.0.739;LOGONLY;2;Normal;An informational condition has been cleared.;;;;;;;;;;;;;;;;;;;;;;;
isxcInformationalAlarm;.1.3.6.1.4.1.318.0.740;LOGONLY;2;Normal;An ISXC Informational Alarm exists.;;;;;;;;;;;;;;;;;;;;;;;
isxcInformationalAlarmCleared;.1.3.6.1.4.1.318.0.741;LOGONLY;2;Normal;An ISXC Informational Alarm has been cleared.;;;;;;;;;;;;;;;;;;;;;;;
isxcWarningAlarm;.1.3.6.1.4.1.318.0.742;LOGONLY;2;Warning;An ISXC Warning Alarm exists.;;;;;;;;;;;;;;;;;;;;;;;
isxcWarningAlarmCleared;.1.3.6.1.4.1.318.0.743;LOGONLY;2;Normal;An ISXC Warning Alarm has been cleared.;;;;;;;;;;;;;;;;;;;;;;;
isxcErrorAlarm;.1.3.6.1.4.1.318.0.744;LOGONLY;2;Normal;An ISXC Error Alarm exists.;;;;;;;;;;;;;;;;;;;;;;;
isxcErrorAlarmCleared;.1.3.6.1.4.1.318.0.745;LOGONLY;2;Normal;An ISXC Error Alarm has been cleared.;;;;;;;;;;;;;;;;;;;;;;;
isxcCriticalAlarm;.1.3.6.1.4.1.318.0.746;LOGONLY;2;Normal;An ISXC Critical Alarm exists.;;;;;;;;;;;;;;;;;;;;;;;
isxcCriticalAlarmCleared;.1.3.6.1.4.1.318.0.747;LOGONLY;2;Normal;An ISXC Critical Alarm has been cleared.;;;;;;;;;;;;;;;;;;;;;;;
isxcFailureAlarm;.1.3.6.1.4.1.318.0.748;LOGONLY;2;Normal;An ISXC Failure Alarm exists.;;;;;;;;;;;;;;;;;;;;;;;
isxcFailureAlarmCleared;.1.3.6.1.4.1.318.0.749;LOGONLY;2;Normal;An ISXC Failure Alarm has been cleared.;;;;;;;;;;;;;;;;;;;;;;;
rpduCriticalCondition;.1.3.6.1.4.1.318.0.750;LOGONLY;2;Normal;A critical condition has been detected.;;;;;;;;;;;;;;;;;;;;;;;
rpduCriticalConditionCleared;.1.3.6.1.4.1.318.0.751;LOGONLY;2;Normal;A critical condition has been cleared.;;;;;;;;;;;;;;;;;;;;;;;
rpduWarningCondition;.1.3.6.1.4.1.318.0.752;LOGONLY;2;Warning;A warning condition has been detected.;;;;;;;;;;;;;;;;;;;;;;;
rpduWarningConditionCleared;.1.3.6.1.4.1.318.0.753;LOGONLY;2;Normal;A warning condition has been cleared.;;;;;;;;;;;;;;;;;;;;;;;
rpduInformationalCondition;.1.3.6.1.4.1.318.0.754;LOGONLY;2;Normal;An informational condition has been detected.;;;;;;;;;;;;;;;;;;;;;;;
rpduInformationalConditionCleared;.1.3.6.1.4.1.318.0.755;LOGONLY;2;Normal;An informational condition has been cleared.;;;;;;;;;;;;;;;;;;;;;;;
isxModularCoolingFanAlarm;.1.3.6.1.4.1.318.0.756;LOGONLY;2;Normal;Cooling fan failure.;;;;;;;;;;;;;;;;;;;;;;;
isxModularCoolingFanAlarmCleared;.1.3.6.1.4.1.318.0.757;LOGONLY;2;Normal;Cooling fan alarm cleared.;;;;;;;;;;;;;;;;;;;;;;;
upsOverLoad;.1.3.6.1.4.1.318.0.2;Energia;2;Critical;The UPS has sensed a load greater than 100 percent of its rated capacity.;;;;;;;;;;;;;;;;;;;;;;;
