xATSRemoteStartContactMismatch;.1.3.6.1.4.1.318.0.417;Energia;2;Normal;Generator/ATS start contact mismatch.;;;;;;;;;;;;;;;;;;;;;;;
xATSRemoteStartContactMismatchCleared;.1.3.6.1.4.1.318.0.418;Energia;2;Normal;Generator/ATS start contact mismatch cleared.;;;;;;;;;;;;;;;;;;;;;;;
xATSDoorOpenAlarm;.1.3.6.1.4.1.318.0.419;Energia;2;Warning;Panel door open alarm.;;;;;;;;;;;;;;;;;;;;;;;
xATSDoorOpenAlarmCleared;.1.3.6.1.4.1.318.0.420;Energia;2;Normal;Panel door open alarm cleared.;;;;;;;;;;;;;;;;;;;;;;;
xATSDCBackupAlarm;.1.3.6.1.4.1.318.0.421;Energia;2;Warning;ATS DC backup failure.;;;;;;;;;;;;;;;;;;;;;;;
xATSDCBackupAlarmCleared;.1.3.6.1.4.1.318.0.422;Energia;2;Normal;DC backup alarm cleared.;;;;;;;;;;;;;;;;;;;;;;;
xATSGeneratorLowCoolantLevelAlarm;.1.3.6.1.4.1.318.0.423;Energia;2;Normal;Generator low coolant level alarm.;;;;;;;;;;;;;;;;;;;;;;;
xATSGeneratorLowCoolantLevelAlarmCleared;.1.3.6.1.4.1.318.0.424;Energia;2;Normal;Generator low coolant level alarm cleared.;;;;;;;;;;;;;;;;;;;;;;;
xATSGeneratorVeryLowCoolantLevelAlarm;.1.3.6.1.4.1.318.0.425;Energia;2;Normal;Generator very low coolant level alarm.;;;;;;;;;;;;;;;;;;;;;;;
xATSGeneratorVeryLowCoolantLevelAlarmCleared;.1.3.6.1.4.1.318.0.426;Energia;2;Normal;Generator very low coolant level alarm cleared.;;;;;;;;;;;;;;;;;;;;;;;
xATSGeneratorHighCoolantTempAlarm;.1.3.6.1.4.1.318.0.427;Energia;2;Normal;Generator high coolant temperature alarm.;;;;;;;;;;;;;;;;;;;;;;;
xATSGeneratorHighCoolantTempAlarmCleared;.1.3.6.1.4.1.318.0.428;Energia;2;Normal;Generator high coolant temperature alarm cleared.;;;;;;;;;;;;;;;;;;;;;;;
xATSGeneratorVeryHighCoolantTempAlarm;.1.3.6.1.4.1.318.0.429;Energia;2;Normal;Generator very high coolant temperature alarm.;;;;;;;;;;;;;;;;;;;;;;;
xATSGeneratorVeryHighCoolantTempAlarmCleared;.1.3.6.1.4.1.318.0.430;Energia;2;Normal;Generator very high coolant temperature alarm cleared.;;;;;;;;;;;;;;;;;;;;;;;
xATSGeneratorLowCoolantTempAlarm;.1.3.6.1.4.1.318.0.431;Energia;2;Warning;Generator low coolant temperature alarm.;;;;;;;;;;;;;;;;;;;;;;;
xATSGeneratorLowCoolantTempAlarmCleared;.1.3.6.1.4.1.318.0.432;Energia;2;Normal;Generator low coolant temperature alarm cleared.;;;;;;;;;;;;;;;;;;;;;;;
xATSGeneratorLowOilLevelAlarm;.1.3.6.1.4.1.318.0.433;Energia;2;Normal;Generator low oil level alarm.;;;;;;;;;;;;;;;;;;;;;;;
xATSGeneratorLowOilLevelAlarmCleared;.1.3.6.1.4.1.318.0.434;Energia;2;Normal;Generator low oil level alarm cleared.;;;;;;;;;;;;;;;;;;;;;;;
xATSGeneratorLowBatteryVoltDuringCrankAlarm;.1.3.6.1.4.1.318.0.435;Energia;2;Normal;Generator low battery volts while cranking alarm.;;;;;;;;;;;;;;;;;;;;;;;
xATSGeneratorLowBatteryVoltDuringCrankAlarmCleared;.1.3.6.1.4.1.318.0.436;Energia;2;Normal;Generator low battery volts while cranking alarm cleared.;;;;;;;;;;;;;;;;;;;;;;;
xATSGeneratorVeryLowBatteryVoltDuringCrankAlarm;.1.3.6.1.4.1.318.0.437;Energia;2;Normal;Generator v.low battery volts while cranking alarm.;;;;;;;;;;;;;;;;;;;;;;;
xATSGeneratorVeryLowBatteryVoltDuringCrankAlarmCleared;.1.3.6.1.4.1.318.0.438;Energia;2;Normal;Generator v.low battery volts while cranking alarm cleared.;;;;;;;;;;;;;;;;;;;;;;;
xATSGeneratorEStop;.1.3.6.1.4.1.318.0.439;Energia;2;Normal;Generator emergency stop engaged.;;;;;;;;;;;;;;;;;;;;;;;
xATSGeneratorEStopCleared;.1.3.6.1.4.1.318.0.440;Energia;2;Normal;Generator emergency stop condition cleared.;;;;;;;;;;;;;;;;;;;;;;;
xATSGeneratorHighBatteryVolt;.1.3.6.1.4.1.318.0.441;Energia;2;Warning;Generator high battery volts.;;;;;;;;;;;;;;;;;;;;;;;
xATSGeneratorHighBatteryVoltCleared;.1.3.6.1.4.1.318.0.442;Energia;2;Normal;Generator high battery volts condition cleared.;;;;;;;;;;;;;;;;;;;;;;;
xATSGeneratorLowBatteryVolt;.1.3.6.1.4.1.318.0.443;Energia;2;Normal;Generator low battery volts.;;;;;;;;;;;;;;;;;;;;;;;
xATSGeneratorLowBatteryVoltCleared;.1.3.6.1.4.1.318.0.444;Energia;2;Normal;Generator low battery volts condition cleared.;;;;;;;;;;;;;;;;;;;;;;;
xATSGeneratorControlSwitchNotAuto;.1.3.6.1.4.1.318.0.445;Energia;2;Normal;Generator notinauto.;;;;;;;;;;;;;;;;;;;;;;;
xATSGeneratorControlSwitchNotAutoCleared;.1.3.6.1.4.1.318.0.446;Energia;2;Normal;Generator notinauto cleared.;;;;;;;;;;;;;;;;;;;;;;;
xATSGeneratorLowOilPressure;.1.3.6.1.4.1.318.0.447;Energia;2;Normal;Generator low oil pressure.;;;;;;;;;;;;;;;;;;;;;;;
xATSGeneratorLowOilPressureCleared;.1.3.6.1.4.1.318.0.448;Energia;2;Normal;Generator low oil pressure condition cleared.;;;;;;;;;;;;;;;;;;;;;;;
xATSGeneratorVeryLowOilPressure;.1.3.6.1.4.1.318.0.449;Energia;2;Normal;Generator v.low oil pressure.;;;;;;;;;;;;;;;;;;;;;;;
xATSGeneratorVeryLowOilPressureCleared;.1.3.6.1.4.1.318.0.450;Energia;2;Normal;Generator v.low oil pressure condition cleared.;;;;;;;;;;;;;;;;;;;;;;;
xATSGeneratorOverload;.1.3.6.1.4.1.318.0.451;Energia;2;Normal;Generator on overload event.;;;;;;;;;;;;;;;;;;;;;;;
xATSGeneratorOverloadCleared;.1.3.6.1.4.1.318.0.452;Energia;2;Normal;Generator on overload event cleared.;;;;;;;;;;;;;;;;;;;;;;;
xATSGeneratorLowACVEvent;.1.3.6.1.4.1.318.0.453;Energia;2;Normal;State of the Generator AC voltage.;;;;;;;;;;;;;;;;;;;;;;;
xATSGeneratorLowACVEventCleared;.1.3.6.1.4.1.318.0.454;Energia;2;Normal;State of the Generator AC voltage cleared.;;;;;;;;;;;;;;;;;;;;;;;
xATSGeneratorHighACVEvent;.1.3.6.1.4.1.318.0.455;Energia;2;Normal;State of the Generator AC voltage.;;;;;;;;;;;;;;;;;;;;;;;
xATSGeneratorHighACVEventCleared;.1.3.6.1.4.1.318.0.456;Energia;2;Normal;State of the Generator AC voltage cleared.;;;;;;;;;;;;;;;;;;;;;;;
xATSGeneratorOverspeed;.1.3.6.1.4.1.318.0.457;Energia;2;Normal;Generator overspeed condition.;;;;;;;;;;;;;;;;;;;;;;;
xATSGeneratorOverspeedCleared;.1.3.6.1.4.1.318.0.458;Energia;2;Normal;Generator overspeed condition cleared.;;;;;;;;;;;;;;;;;;;;;;;
xATSGeneratorEngineCold;.1.3.6.1.4.1.318.0.459;Energia;2;Normal;Generator engine is cold.;;;;;;;;;;;;;;;;;;;;;;;
xATSGeneratorEngineColdCleared;.1.3.6.1.4.1.318.0.460;Energia;2;Normal;Engine is cold to start condition cleared.;;;;;;;;;;;;;;;;;;;;;;;
xATSGeneratorOutputBreakerOpen;.1.3.6.1.4.1.318.0.461;Energia;2;Normal;Generator output breaker open.;;;;;;;;;;;;;;;;;;;;;;;
xATSGeneratorOutputBreakerOpenCleared;.1.3.6.1.4.1.318.0.462;Energia;2;Normal;Generator output breaker open cleared.;;;;;;;;;;;;;;;;;;;;;;;
xATSGeneratorLowFuelLevelAlarm;.1.3.6.1.4.1.318.0.463;Energia;2;Warning;Generator low fuel level alarm.;;;;;;;;;;;;;;;;;;;;;;;
xATSGeneratorLowFuelLevelAlarmCleared;.1.3.6.1.4.1.318.0.464;Energia;2;Normal;Generator low fuel level alarm cleared.;;;;;;;;;;;;;;;;;;;;;;;
xATSGeneratorVeryLowFuelLevelAlarm;.1.3.6.1.4.1.318.0.465;Energia;2;Normal;Generator very low fuel level alarm.;;;;;;;;;;;;;;;;;;;;;;;
xATSGeneratorVeryLowFuelLevelAlarmCleared;.1.3.6.1.4.1.318.0.466;Energia;2;Normal;Generator very low fuel level alarm cleared.;;;;;;;;;;;;;;;;;;;;;;;
xATSGeneratorLowRunTimeAlarm;.1.3.6.1.4.1.318.0.467;Energia;2;Warning;Generator low run time alarm.;;;;;;;;;;;;;;;;;;;;;;;
xATSGeneratorLowRunTimeAlarmCleared;.1.3.6.1.4.1.318.0.468;Energia;2;Normal;Generator low run time alarm.;;;;;;;;;;;;;;;;;;;;;;;
xATSGeneratorVeryLowRunTimeAlarm;.1.3.6.1.4.1.318.0.469;Energia;2;Normal;Generator very low run time alarm.;;;;;;;;;;;;;;;;;;;;;;;
xATSGeneratorVeryLowRunTimeAlarmCleared;.1.3.6.1.4.1.318.0.470;Energia;2;Normal;Generator very low run time alarm.;;;;;;;;;;;;;;;;;;;;;;;
xATSGeneratorServiceDueAlarm;.1.3.6.1.4.1.318.0.471;Energia;2;Warning;Generator maintenance due.;;;;;;;;;;;;;;;;;;;;;;;
xATSGeneratorServiceDueAlarmCleared;.1.3.6.1.4.1.318.0.472;Energia;2;Normal;Generator service alarm is cleared.;;;;;;;;;;;;;;;;;;;;;;;
xATSGeneratorShutdown;.1.3.6.1.4.1.318.0.473;Energia;2;Normal;Generator shutdown;;;;;;;;;;;;;;;;;;;;;;;
xATSGeneratorShutdownCleared;.1.3.6.1.4.1.318.0.474;Energia;2;Normal;Generator shutdown is cleared.;;;;;;;;;;;;;;;;;;;;;;;
xATSGeneratorBatteryCharger;.1.3.6.1.4.1.318.0.475;Energia;2;Normal;Generator battery charger is nonfunctional;;;;;;;;;;;;;;;;;;;;;;;
xATSGeneratorBatteryChargerCleared;.1.3.6.1.4.1.318.0.476;Energia;2;Normal;Fault in the generator battery charger is cleared.;;;;;;;;;;;;;;;;;;;;;;;
xATSGeneratorGenericEvent;.1.3.6.1.4.1.318.0.477;Energia;2;Warning;Generator generic event.;;;;;;;;;;;;;;;;;;;;;;;
xATSGeneratorGenericEventCleared;.1.3.6.1.4.1.318.0.478;Energia;2;Normal;Generic generator event is cleared.;;;;;;;;;;;;;;;;;;;;;;;
xPDUInternalCommErrorCleared;.1.3.6.1.4.1.318.0.479;Energia;2;Normal;Communication error cleared.;;;;;;;;;;;;;;;;;;;;;;;
xPDUSystemStateAlarm;.1.3.6.1.4.1.318.0.480;Energia;2;Normal;PDU state change alarm.;;;;;;;;;;;;;;;;;;;;;;;
xPDUSystemStateAlarmCleared;.1.3.6.1.4.1.318.0.481;Energia;2;Normal;PDU normal state change.;;;;;;;;;;;;;;;;;;;;;;;
xPDUEpoTestMode;.1.3.6.1.4.1.318.0.482;Energia;2;Warning;EPO disabled.;;;;;;;;;;;;;;;;;;;;;;;
xPDUEpoArmed;.1.3.6.1.4.1.318.0.483;Energia;2;Normal;EPO armed.;;;;;;;;;;;;;;;;;;;;;;;
xPDUFuseBlownAlarm;.1.3.6.1.4.1.318.0.484;Energia;2;Normal;Fuse detected opened.;;;;;;;;;;;;;;;;;;;;;;;
xPDUFuseBlownAlarmCleared;.1.3.6.1.4.1.318.0.485;Energia;2;Normal;Fuse alarm cleared.;;;;;;;;;;;;;;;;;;;;;;;
xPDUBreakerPositionAlarm;.1.3.6.1.4.1.318.0.486;Energia;2;Normal;Breaker position alarm.;;;;;;;;;;;;;;;;;;;;;;;
xPDUBreakerPositionAlarmCleared;.1.3.6.1.4.1.318.0.487;Energia;2;Normal;Breaker alarm cleared.;;;;;;;;;;;;;;;;;;;;;;;
xPDUBreakerChangeEvent;.1.3.6.1.4.1.318.0.488;Energia;2;Normal;Breaker/switch change event.;;;;;;;;;;;;;;;;;;;;;;;
xPDUDataCommMismatchError;.1.3.6.1.4.1.318.0.489;Energia;2;Normal;XPDU data mismatch error.;;;;;;;;;;;;;;;;;;;;;;;
xPDUDataCommMismatchErrorCleared;.1.3.6.1.4.1.318.0.490;Energia;2;Normal;XPDU data mismatch error cleared.;;;;;;;;;;;;;;;;;;;;;;;
xPDUSystemInMaintenanceBypassMode;.1.3.6.1.4.1.318.0.491;Energia;2;Warning;PDU state changed to maintenance bypass.;;;;;;;;;;;;;;;;;;;;;;;
xPDUSystemInUPSOperationalMode;.1.3.6.1.4.1.318.0.492;Energia;2;Normal;PDU state changed to UPS operational.;;;;;;;;;;;;;;;;;;;;;;;
xATSGeneratorFuelTankRuptureAlarm;.1.3.6.1.4.1.318.0.493;Energia;2;Warning;Generator inner wall rupture alarm.;;;;;;;;;;;;;;;;;;;;;;;
xATSGeneratorFuelTankRuptureAlarmCleared;.1.3.6.1.4.1.318.0.494;Energia;2;Normal;Generator inner wall rupture alarm cleared.;;;;;;;;;;;;;;;;;;;;;;;
xATSGeneratorGroundFaultAlarm;.1.3.6.1.4.1.318.0.495;Energia;2;Normal;Generator ground fault alarm.;;;;;;;;;;;;;;;;;;;;;;;
xATSGeneratorGroundFaultAlarmCleared;.1.3.6.1.4.1.318.0.496;Energia;2;Normal;Generator ground fault alarm cleared.;;;;;;;;;;;;;;;;;;;;;;;
xATSOutputLoadPoweredByGeneratorAlarm;.1.3.6.1.4.1.318.0.497;Energia;2;Warning;System load powered by generator.;;;;;;;;;;;;;;;;;;;;;;;
xATSOutputLoadPoweredByGeneratorAlarmCleared;.1.3.6.1.4.1.318.0.498;Energia;2;Normal;System load powered by generator alarm cleared.;;;;;;;;;;;;;;;;;;;;;;;
xAPCControllerFirmwareUpdateTransferStart;.1.3.6.1.4.1.318.0.499;Energia;2;Normal;Start update transfer.;;;;;;;;;;;;;;;;;;;;;;;
xAPCControllerFirmwareUpdateTransferComplete;.1.3.6.1.4.1.318.0.500;Energia;2;Normal;Update transfer complete.;;;;;;;;;;;;;;;;;;;;;;;
xAPCControllerFirmwareUpdateTransferFailed;.1.3.6.1.4.1.318.0.501;Energia;2;Normal;Update transfer failed.;;;;;;;;;;;;;;;;;;;;;;;
upsPfcInputRelayFailure;.1.3.6.1.4.1.318.0.502;Energia;2;Warning;The PFC (Power Factor Correction) input relay failure exists.;;;;;;;;;;;;;;;;;;;;;;;
upsPfcInputRelayFailureCleared;.1.3.6.1.4.1.318.0.503;Energia;2;Normal;The PFC (Power Factor Correction) input relay failure cleared.;;;;;;;;;;;;;;;;;;;;;;;
upsInverterOverTemperature;.1.3.6.1.4.1.318.0.504;Energia;2;Warning;The inverter over temperature condition exists.;;;;;;;;;;;;;;;;;;;;;;;
upsInverterOverTemperatureCleared;.1.3.6.1.4.1.318.0.505;Energia;2;Normal;The inverter over temperature condition cleared.;;;;;;;;;;;;;;;;;;;;;;;
upsBatteryOverVoltage;.1.3.6.1.4.1.318.0.506;Energia;2;Warning;The battery over voltage condition exists.;;;;;;;;;;;;;;;;;;;;;;;
upsBatteryOverVoltageCleared;.1.3.6.1.4.1.318.0.507;Energia;2;Normal;The battery over voltage condition cleared.;;;;;;;;;;;;;;;;;;;;;;;
upsEepromFault;.1.3.6.1.4.1.318.0.508;Energia;2;Warning;The EEPROM fault exists.;;;;;;;;;;;;;;;;;;;;;;;
upsEepromFaultCleared;.1.3.6.1.4.1.318.0.509;Energia;2;Normal;The EEPROM fault cleared.;;;;;;;;;;;;;;;;;;;;;;;
aruFanRuntimeAlarm;.1.3.6.1.4.1.318.0.510;Energia;2;Warning;Fan Runhour Alarm.;;;;;;;;;;;;;;;;;;;;;;;
aruFanRuntimeAlarmCleared;.1.3.6.1.4.1.318.0.511;Energia;2;Normal;Fan Runhour Alarm Cleared.;;;;;;;;;;;;;;;;;;;;;;;
aruFanPoorPerformanceAlarm;.1.3.6.1.4.1.318.0.512;Energia;2;Warning;Fan Health Alarm.;;;;;;;;;;;;;;;;;;;;;;;
aruFanPoorPerformanceAlarmCleared;.1.3.6.1.4.1.318.0.513;Energia;2;Normal;Fan Health Alarm Cleared.;;;;;;;;;;;;;;;;;;;;;;;
aruRedundantPowerLostAlarm;.1.3.6.1.4.1.318.0.514;Energia;2;Warning;AC Redundancy Lost.;;;;;;;;;;;;;;;;;;;;;;;
aruRedundantPowerLostAlarmCleared;.1.3.6.1.4.1.318.0.515;Energia;2;Normal;AC Redundancy Restored.;;;;;;;;;;;;;;;;;;;;;;;
apcDeviceConfigChange;.1.3.6.1.4.1.318.0.516;Energia;2;Normal;A device configuration change has been made on a device.;;;;;;;;;;;;;;;;;;;;;;;
apcEnvSensorConnected;.1.3.6.1.4.1.318.0.517;Energia;2;Normal;Sensor Connected.;;;;;;;;;;;;;;;;;;;;;;;
apcEnvSensorDisconnected;.1.3.6.1.4.1.318.0.518;Energia;2;Normal;Sensor Disconnected.;;;;;;;;;;;;;;;;;;;;;;;
apcEnvMaxTempThresholdViolation;.1.3.6.1.4.1.318.0.519;Energia;2;Normal;Max temperature threshold violation.;;;;;;;;;;;;;;;;;;;;;;;
apcEnvMaxTempThresholdViolationCleared;.1.3.6.1.4.1.318.0.520;Energia;2;Normal;Max temperature threshold violation cleared.;;;;;;;;;;;;;;;;;;;;;;;
apcEnvHighTempThresholdViolation;.1.3.6.1.4.1.318.0.521;Energia;2;Warning;High temperature threshold violation.;;;;;;;;;;;;;;;;;;;;;;;
apcEnvHighTempThresholdViolationCleared;.1.3.6.1.4.1.318.0.522;Energia;2;Normal;High temperature threshold violation cleared.;;;;;;;;;;;;;;;;;;;;;;;
apcEnvLowTempThresholdViolation;.1.3.6.1.4.1.318.0.523;Energia;2;Warning;Low temperature threshold violation.;;;;;;;;;;;;;;;;;;;;;;;
apcEnvLowTempThresholdViolationCleared;.1.3.6.1.4.1.318.0.524;Energia;2;Normal;Low temperature threshold violation cleared.;;;;;;;;;;;;;;;;;;;;;;;
apcEnvMinTempThresholdViolation;.1.3.6.1.4.1.318.0.525;Energia;2;Normal;Min temperature threshold violation.;;;;;;;;;;;;;;;;;;;;;;;
apcEnvMinTempThresholdViolationCleared;.1.3.6.1.4.1.318.0.526;Energia;2;Normal;Min temperature threshold violation cleared.;;;;;;;;;;;;;;;;;;;;;;;
apcEnvSTIncTempRateViolation;.1.3.6.1.4.1.318.0.527;Energia;2;Normal;Shortterm inc. temp rate violation.;;;;;;;;;;;;;;;;;;;;;;;
apcEnvSTIncTempRateViolationCleared;.1.3.6.1.4.1.318.0.528;Energia;2;Normal;Shortterm inc. temp rate violation cleared.;;;;;;;;;;;;;;;;;;;;;;;
apcEnvSTDecTempRateViolation;.1.3.6.1.4.1.318.0.529;Energia;2;Normal;Shortterm dec. temp rate violation.;;;;;;;;;;;;;;;;;;;;;;;
apcEnvSTDecTempRateViolationCleared;.1.3.6.1.4.1.318.0.530;Energia;2;Normal;Shortterm dec. temp rate violation cleared.;;;;;;;;;;;;;;;;;;;;;;;
apcEnvLTIncTempRateViolation;.1.3.6.1.4.1.318.0.531;Energia;2;Normal;Longterm inc. temp rate violation.;;;;;;;;;;;;;;;;;;;;;;;
apcEnvLTIncTempRateViolationCleared;.1.3.6.1.4.1.318.0.532;Energia;2;Normal;Longterm inc. temp rate violation cleared.;;;;;;;;;;;;;;;;;;;;;;;
apcEnvLTDecTempRateViolation;.1.3.6.1.4.1.318.0.533;Energia;2;Normal;Longterm dec. temp rate violation.;;;;;;;;;;;;;;;;;;;;;;;
apcEnvLTDecTempRateViolationCleared;.1.3.6.1.4.1.318.0.534;Energia;2;Normal;Longterm dec. temp rate violation cleared.;;;;;;;;;;;;;;;;;;;;;;;
apcEnvMaxHumidityThresholdViolation;.1.3.6.1.4.1.318.0.535;Energia;2;Normal;Max humidity threshold violation.;;;;;;;;;;;;;;;;;;;;;;;
apcEnvMaxHumidityThresholdViolationCleared;.1.3.6.1.4.1.318.0.536;Energia;2;Normal;Max humidity threshold violation cleared.;;;;;;;;;;;;;;;;;;;;;;;
apcEnvHighHumidityThresholdViolation;.1.3.6.1.4.1.318.0.537;Energia;2;Warning;High humidity threshold violation.;;;;;;;;;;;;;;;;;;;;;;;
apcEnvHighHumidityThresholdViolationCleared;.1.3.6.1.4.1.318.0.538;Energia;2;Normal;High humidity threshold violation cleared.;;;;;;;;;;;;;;;;;;;;;;;
apcEnvLowHumidityThresholdViolation;.1.3.6.1.4.1.318.0.539;Energia;2;Warning;Low humidity threshold violation.;;;;;;;;;;;;;;;;;;;;;;;
apcEnvLowHumidityThresholdViolationCleared;.1.3.6.1.4.1.318.0.540;Energia;2;Normal;Low humidity threshold violation cleared.;;;;;;;;;;;;;;;;;;;;;;;
apcEnvMinHumidityThresholdViolation;.1.3.6.1.4.1.318.0.541;Energia;2;Normal;Min humidity threshold violation.;;;;;;;;;;;;;;;;;;;;;;;
apcEnvMinHumidityThresholdViolationCleared;.1.3.6.1.4.1.318.0.542;Energia;2;Normal;Min humidity threshold violation cleared.;;;;;;;;;;;;;;;;;;;;;;;
apcBeaconConnected;.1.3.6.1.4.1.318.0.543;Energia;2;Normal;Beacon Connected.;;;;;;;;;;;;;;;;;;;;;;;
apcBeaconDisconnected;.1.3.6.1.4.1.318.0.544;Energia;2;Normal;Beacon Disconnected.;;;;;;;;;;;;;;;;;;;;;;;
apcBeaconOn;.1.3.6.1.4.1.318.0.545;Energia;2;Normal;Beacon On.;;;;;;;;;;;;;;;;;;;;;;;
apcBeaconOff;.1.3.6.1.4.1.318.0.546;Energia;2;Normal;Beacon Off.;;;;;;;;;;;;;;;;;;;;;;;
apcOutletStateAbnormal;.1.3.6.1.4.1.318.0.547;Energia;2;Warning;Outlet has changed to its abnormal state.;;;;;;;;;;;;;;;;;;;;;;;
apcOutletStateNormal;.1.3.6.1.4.1.318.0.548;Energia;2;Normal;Outlet has changed to its normal state.;;;;;;;;;;;;;;;;;;;;;;;
apcOutputRelayStateAbnormal;.1.3.6.1.4.1.318.0.549;Energia;2;Warning;Output Relay has changed to its abnormal state.;;;;;;;;;;;;;;;;;;;;;;;
apcOutputRelayStateNormal;.1.3.6.1.4.1.318.0.550;Energia;2;Normal;Output Relay has changed to its normal state.;;;;;;;;;;;;;;;;;;;;;;;
apcHardwareStateAbnormal;.1.3.6.1.4.1.318.0.551;Energia;2;Normal;Hardware is in an abnormal state.;;;;;;;;;;;;;;;;;;;;;;;
apcHardwareStateNormal;.1.3.6.1.4.1.318.0.552;Energia;2;Normal;Hardware is in its normal state.;;;;;;;;;;;;;;;;;;;;;;;
apcCriticalDiscreteInputContactStateAbnormal;.1.3.6.1.4.1.318.0.553;Energia;2;Normal;Discrete input contact has changed to its abnormal state.;;;;;;;;;;;;;;;;;;;;;;;
apcCriticalDiscreteInputContactStateNormal;.1.3.6.1.4.1.318.0.554;Energia;2;Normal;Discrete input contact has changed to its normal state.;;;;;;;;;;;;;;;;;;;;;;;
apcWarningDiscreteInputContactStateAbnormal;.1.3.6.1.4.1.318.0.555;Energia;2;Warning;Discrete input contact has changed to its abnormal state.;;;;;;;;;;;;;;;;;;;;;;;
apcWarningDiscreteInputContactStateNormal;.1.3.6.1.4.1.318.0.556;Energia;2;Normal;Discrete input contact has changed to its normal state.;;;;;;;;;;;;;;;;;;;;;;;
apcInformationalDiscreteInputContactStateAbnormal;.1.3.6.1.4.1.318.0.557;Energia;2;Normal;Discrete input contact has changed to its abnormal state.;;;;;;;;;;;;;;;;;;;;;;;
apcInformationalDiscreteInputContactStateNormal;.1.3.6.1.4.1.318.0.558;Energia;2;Normal;Discrete input contact has changed to its normal state.;;;;;;;;;;;;;;;;;;;;;;;
apcAnalogInputMaxThresholdViolation;.1.3.6.1.4.1.318.0.559;Energia;2;Normal;Max threshold violation on input.;;;;;;;;;;;;;;;;;;;;;;;
apcAnalogInputMaxThresholdViolationCleared;.1.3.6.1.4.1.318.0.560;Energia;2;Normal;Max threshold violation cleared.;;;;;;;;;;;;;;;;;;;;;;;
apcAnalogInputHighThresholdViolation;.1.3.6.1.4.1.318.0.561;Energia;2;Warning;High threshold violation on input.;;;;;;;;;;;;;;;;;;;;;;;
apcAnalogInputHighThresholdViolationCleared;.1.3.6.1.4.1.318.0.562;Energia;2;Normal;High threshold violation cleared.;;;;;;;;;;;;;;;;;;;;;;;
apcAnalogInputLowThresholdViolation;.1.3.6.1.4.1.318.0.563;Energia;2;Warning;Low threshold violation on input.;;;;;;;;;;;;;;;;;;;;;;;
apcAnalogInputLowThresholdViolationCleared;.1.3.6.1.4.1.318.0.564;Energia;2;Normal;Low threshold violation cleared.;;;;;;;;;;;;;;;;;;;;;;;
apcAnalogInputMinThresholdViolation;.1.3.6.1.4.1.318.0.565;Energia;2;Normal;Min threshold violation on input.;;;;;;;;;;;;;;;;;;;;;;;
apcAnalogInputMinThresholdViolationCleared;.1.3.6.1.4.1.318.0.566;Energia;2;Normal;Min threshold violation cleared.;;;;;;;;;;;;;;;;;;;;;;;
apcDeviceClearLostComms;.1.3.6.1.4.1.318.0.567;Energia;2;Normal;Lost communications reset command has been issued.;;;;;;;;;;;;;;;;;;;;;;;
apcDeviceConnected;.1.3.6.1.4.1.318.0.568;Energia;2;Normal;Device Connected.;;;;;;;;;;;;;;;;;;;;;;;
apcDeviceDisconnected;.1.3.6.1.4.1.318.0.569;Energia;2;Normal;Device Disconnected.;;;;;;;;;;;;;;;;;;;;;;;
apcUnregisteredUserAccessDenied;.1.3.6.1.4.1.318.0.570;Energia;2;Normal;Unregistered user.;;;;;;;;;;;;;;;;;;;;;;;
apcRegisteredUserAccessDenied;.1.3.6.1.4.1.318.0.571;Energia;2;Normal;Access denied.;;;;;;;;;;;;;;;;;;;;;;;
apcRegisteredUserConfigChange;.1.3.6.1.4.1.318.0.572;Energia;2;Normal;Registered user configuration change.;;;;;;;;;;;;;;;;;;;;;;;
apcDoorUnlocked;.1.3.6.1.4.1.318.0.573;Energia;2;Normal;Door unlocked.;;;;;;;;;;;;;;;;;;;;;;;
apcDoorLocked;.1.3.6.1.4.1.318.0.574;Energia;2;Normal;Door locked.;;;;;;;;;;;;;;;;;;;;;;;
apcHandleOpened;.1.3.6.1.4.1.318.0.575;Energia;2;Normal;Door handle opened.;;;;;;;;;;;;;;;;;;;;;;;
apcHandleClosed;.1.3.6.1.4.1.318.0.576;Energia;2;Normal;Door handle closed.;;;;;;;;;;;;;;;;;;;;;;;
apcDoorOpened;.1.3.6.1.4.1.318.0.577;Energia;2;Normal;Door opened.;;;;;;;;;;;;;;;;;;;;;;;
apcDoorClosed;.1.3.6.1.4.1.318.0.578;Energia;2;Normal;Door closed.;;;;;;;;;;;;;;;;;;;;;;;
apcKeyOverrideUnlocked;.1.3.6.1.4.1.318.0.580;Energia;2;Normal;Key override unlock has occurred.;;;;;;;;;;;;;;;;;;;;;;;
apcKeyOverrideLocked;.1.3.6.1.4.1.318.0.581;Energia;2;Normal;Key override lock has occurred.;;;;;;;;;;;;;;;;;;;;;;;
apcForcedEntry;.1.3.6.1.4.1.318.0.582;Energia;2;Normal;A forced entry has occurred.;;;;;;;;;;;;;;;;;;;;;;;
apcForcedEntryCleared;.1.3.6.1.4.1.318.0.583;Energia;2;Normal;A forced entry has been cleared.;;;;;;;;;;;;;;;;;;;;;;;
apcRelockTimeout;.1.3.6.1.4.1.318.0.584;Energia;2;Normal;Relock timeout.;;;;;;;;;;;;;;;;;;;;;;;
apcRelockTimeoutCleared;.1.3.6.1.4.1.318.0.585;Energia;2;Normal;Relock timout has been cleared.;;;;;;;;;;;;;;;;;;;;;;;
apcDoorSenseDisconnected;.1.3.6.1.4.1.318.0.586;Energia;2;Normal;A door sensor was disconnected.;;;;;;;;;;;;;;;;;;;;;;;
apcDoorSenseConnected;.1.3.6.1.4.1.318.0.587;Energia;2;Normal;A door sensor was connected.;;;;;;;;;;;;;;;;;;;;;;;
apcDoorLostComms;.1.3.6.1.4.1.318.0.588;Energia;2;Normal;A door has lost communications.;;;;;;;;;;;;;;;;;;;;;;;
apcDoorEstablishedComms;.1.3.6.1.4.1.318.0.589;Energia;2;Normal;A door has established communications.;;;;;;;;;;;;;;;;;;;;;;;
apcRegisteredUserAccessChange;.1.3.6.1.4.1.318.0.590;Energia;2;Normal;Registered user access change.;;;;;;;;;;;;;;;;;;;;;;;
apcUnregisteredUserStatusChange;.1.3.6.1.4.1.318.0.591;Energia;2;Normal;Unregistered user status change.;;;;;;;;;;;;;;;;;;;;;;;
apcDeviceClearUserConfigs;.1.3.6.1.4.1.318.0.592;Energia;2;Normal;User configurations reset command has been issued.;;;;;;;;;;;;;;;;;;;;;;;
upsBatteryTempSensorFault;.1.3.6.1.4.1.318.0.600;Energia;2;Warning;The battery temperature sensor fault exists.;;;;;;;;;;;;;;;;;;;;;;;
upsBatteryTempSensorFaultCleared;.1.3.6.1.4.1.318.0.601;Energia;2;Normal;The battery temperature sensor fault cleared.;;;;;;;;;;;;;;;;;;;;;;;
upsBatterySoftBusStartFault;.1.3.6.1.4.1.318.0.602;Energia;2;Warning;A battery bus soft start fault exists.;;;;;;;;;;;;;;;;;;;;;;;
upsBatterySoftBusStartFaultCleared;.1.3.6.1.4.1.318.0.603;Energia;2;Normal;A battery bus soft start fault exists cleared.;;;;;;;;;;;;;;;;;;;;;;;
apcOutputShortCircuit;.1.3.6.1.4.1.318.0.604;Energia;2;Warning;An output short circuit condition exists.;;;;;;;;;;;;;;;;;;;;;;;
apcOutputShortCircuitCleared;.1.3.6.1.4.1.318.0.605;Energia;2;Normal;An output short circuit condition cleared.;;;;;;;;;;;;;;;;;;;;;;;
apcOutputRelayFault;.1.3.6.1.4.1.318.0.606;Energia;2;Warning;An output relay (or its driver) fault exists.;;;;;;;;;;;;;;;;;;;;;;;
apcOutputRelayFaultCleared;.1.3.6.1.4.1.318.0.607;Energia;2;Normal;An output relay (or its driver) fault cleared.;;;;;;;;;;;;;;;;;;;;;;;
upsPfcFault;.1.3.6.1.4.1.318.0.608;Energia;2;Warning;A PFC fault exists.;;;;;;;;;;;;;;;;;;;;;;;
upsPfcFaultCleared;.1.3.6.1.4.1.318.0.609;Energia;2;Normal;The PFC fault cleared.;;;;;;;;;;;;;;;;;;;;;;;
apcDcBusOverVoltage;.1.3.6.1.4.1.318.0.610;Energia;2;Warning;The DC bus voltage is too high.;;;;;;;;;;;;;;;;;;;;;;;
apcDcBusOverVoltageCleared;.1.3.6.1.4.1.318.0.611;Energia;2;Normal;The DC bus voltage is too high cleared.;;;;;;;;;;;;;;;;;;;;;;;
upsInverterFault;.1.3.6.1.4.1.318.0.612;Energia;2;Warning;The inverter fault exists.;;;;;;;;;;;;;;;;;;;;;;;
upsInverterFaultCleared;.1.3.6.1.4.1.318.0.613;Energia;2;Normal;The inverter fault cleared.;;;;;;;;;;;;;;;;;;;;;;;
apcAdConverterFault;.1.3.6.1.4.1.318.0.614;Energia;2;Warning;The A/D converter fault exists.;;;;;;;;;;;;;;;;;;;;;;;
apcAdConverterFaultCleared;.1.3.6.1.4.1.318.0.615;Energia;2;Normal;The A/D converter fault cleared.;;;;;;;;;;;;;;;;;;;;;;;
apcLogicPowerSupplyFault;.1.3.6.1.4.1.318.0.616;Energia;2;Warning;A logic power supply fault exists.;;;;;;;;;;;;;;;;;;;;;;;
apcLogicPowerSupplyFaultCleared;.1.3.6.1.4.1.318.0.617;Energia;2;Normal;A logic power supply fault cleared.;;;;;;;;;;;;;;;;;;;;;;;
apcTransformerDCImbalanceFault;.1.3.6.1.4.1.318.0.618;Energia;2;Warning;The DC component of the transformer's current is too high.;;;;;;;;;;;;;;;;;;;;;;;
apcTransformerDCImbalanceFaultCleared;.1.3.6.1.4.1.318.0.619;Energia;2;Normal;The DC component of the transformer's current is normal.;;;;;;;;;;;;;;;;;;;;;;;
upsBackfeedRelayFault;.1.3.6.1.4.1.318.0.620;Energia;2;Warning;The backfeed relay (or its driver) has a fault.;;;;;;;;;;;;;;;;;;;;;;;
upsBackfeedRelayFaultCleared;.1.3.6.1.4.1.318.0.621;Energia;2;Normal;The backfeed relay (or its driver) has a fault cleared.;;;;;;;;;;;;;;;;;;;;;;;
upsBypassRelayFault;.1.3.6.1.4.1.318.0.622;Energia;2;Warning;A bypass relay (or its driver) has a fault.;;;;;;;;;;;;;;;;;;;;;;;
upsBypassRelayFaultCleared;.1.3.6.1.4.1.318.0.623;Energia;2;Normal;A bypass relay (or its driver) has a fault cleared.;;;;;;;;;;;;;;;;;;;;;;;
xPDUBranchCurrentMinAlarm;.1.3.6.1.4.1.318.0.626;Energia;2;Normal;Branch circuit current is below threshold.;;;;;;;;;;;;;;;;;;;;;;;
xPDUBranchCurrentMinAlarmCleared;.1.3.6.1.4.1.318.0.627;Energia;2;Normal;Branch circuit low current alarm cleared.;;;;;;;;;;;;;;;;;;;;;;;
