pduCircuitPanelInputOvercurrent;.1.3.6.1.4.1.318.0.203;Energia;2;Normal;Circuit Panel Input Overcurrent.;;;;;;;;;;;;;;;;;;;;;;;
pduCircuitPanelInputOvercurrentCleared;.1.3.6.1.4.1.318.0.204;Energia;2;Normal;Circuit Panel Input Overcurrent Cleared.;;;;;;;;;;;;;;;;;;;;;;;
pduCircuitPanelFrequencyOutOfRange;.1.3.6.1.4.1.318.0.205;Energia;2;Normal;Circuit Panel Input Frequency Out Of Range.;;;;;;;;;;;;;;;;;;;;;;;
pduCircuitPanelFrequencyOutofRangeCleared;.1.3.6.1.4.1.318.0.206;Energia;2;Normal;Circuit Panel Input Frequency No Longer Out Of Range.;;;;;;;;;;;;;;;;;;;;;;;
pduCircuitPanelNeutralOvercurrent;.1.3.6.1.4.1.318.0.207;Energia;2;Normal;Circuit Panel Input Neutral Overcurrent.;;;;;;;;;;;;;;;;;;;;;;;
pduCircuitPanelNeutralOvercurrentCleared;.1.3.6.1.4.1.318.0.208;Energia;2;Normal;Circuit Panel Input Neutral Overcurrent Cleared.;;;;;;;;;;;;;;;;;;;;;;;
pduSystemOff;.1.3.6.1.4.1.318.0.209;Energia;2;Normal;PDU System Off.;;;;;;;;;;;;;;;;;;;;;;;
pduOnBatteryMode;.1.3.6.1.4.1.318.0.210;Energia;2;Normal;PDU is in On Battery Mode.;;;;;;;;;;;;;;;;;;;;;;;
pduMaintenanceBypassMode;.1.3.6.1.4.1.318.0.211;Energia;2;Normal;PDU is in Maintenance Bypass Mode.;;;;;;;;;;;;;;;;;;;;;;;
pduAtypicalBypassMode;.1.3.6.1.4.1.318.0.212;Energia;2;Warning;PDU is in Atypical Bypass Mode.;;;;;;;;;;;;;;;;;;;;;;;
pduNoPanelFeedMode;.1.3.6.1.4.1.318.0.213;Energia;2;Normal;PDU is in No Panel Feed Mode.;;;;;;;;;;;;;;;;;;;;;;;
pduUpsOperationMode;.1.3.6.1.4.1.318.0.214;Energia;2;Normal;PDU is in Ups Operation Mode.;;;;;;;;;;;;;;;;;;;;;;;
pduForcedBypassMode;.1.3.6.1.4.1.318.0.215;Energia;2;Warning;PDU is in Forced Bypass Mode.;;;;;;;;;;;;;;;;;;;;;;;
pduInputTransformerOverTemperature;.1.3.6.1.4.1.318.0.216;Energia;2;Normal;Input Transformer Over Temperature.;;;;;;;;;;;;;;;;;;;;;;;
pduInputTransformerOverTemperatureCleared;.1.3.6.1.4.1.318.0.217;Energia;2;Normal;Input Transformer Over Temperature Cleared.;;;;;;;;;;;;;;;;;;;;;;;
pduUPSInputVoltageLost;.1.3.6.1.4.1.318.0.218;Energia;2;Normal;UPS Input Voltage phaseN Lost.;;;;;;;;;;;;;;;;;;;;;;;
pduUPSInputVoltageRestored;.1.3.6.1.4.1.318.0.219;Energia;2;Normal;UPS Input Voltage phaseN Restored.;;;;;;;;;;;;;;;;;;;;;;;
pduContactFault;.1.3.6.1.4.1.318.0.220;Energia;2;Normal;Contact Abnormal.;;;;;;;;;;;;;;;;;;;;;;;
pduContactFaultCleared;.1.3.6.1.4.1.318.0.221;Energia;2;Normal;Contact Normal.;;;;;;;;;;;;;;;;;;;;;;;
rPDUBankPhaseLowLoad;.1.3.6.1.4.1.318.0.222;Energia;2;Warning;A bank or phase on the Rack PDU has violated the low load threshold.;;;;;;;;;;;;;;;;;;;;;;;
rPDUBankPhaseLowLoadCleared;.1.3.6.1.4.1.318.0.223;Energia;2;Normal;The bank or phase low load condition on a Rack PDU has been cleared.;;;;;;;;;;;;;;;;;;;;;;;
rPDUBankPhaseNearOverload;.1.3.6.1.4.1.318.0.224;Energia;2;Warning;A bank or phase of the Rack PDU is near an overload condition.;;;;;;;;;;;;;;;;;;;;;;;
rPDUBankPhaseNearOverloadCleared;.1.3.6.1.4.1.318.0.225;Energia;2;Normal;Rack PDU bank or phase near overload condition has cleared.;;;;;;;;;;;;;;;;;;;;;;;
rPDUBankPhaseOverload;.1.3.6.1.4.1.318.0.226;Energia;2;Normal;A bank or phase of the Rack PDU is in an overload condition.;;;;;;;;;;;;;;;;;;;;;;;
rPDUBankPhaseOverloadCleared;.1.3.6.1.4.1.318.0.227;Energia;2;Normal;The bank or phase overload condition on a Rack PDU has cleared.;;;;;;;;;;;;;;;;;;;;;;;
aruDeviceConfigChange;.1.3.6.1.4.1.318.0.228;Energia;2;Normal;ARU device configuration change.;;;;;;;;;;;;;;;;;;;;;;;
rmPDUCommunicationLost;.1.3.6.1.4.1.318.0.229;Energia;2;Normal;Communication Lost.;;;;;;;;;;;;;;;;;;;;;;;
emsCommunicationEstablished;.1.3.6.1.4.1.318.0.230;Energia;2;Normal;Communication Established.;;;;;;;;;;;;;;;;;;;;;;;
emsCommunicationLost;.1.3.6.1.4.1.318.0.231;Energia;2;Normal;Communication Lost.;;;;;;;;;;;;;;;;;;;;;;;
emsProbeConnected;.1.3.6.1.4.1.318.0.232;Energia;2;Normal;Probe Connected.;;;;;;;;;;;;;;;;;;;;;;;
emsProbeDisconnected;.1.3.6.1.4.1.318.0.233;Energia;2;Normal;Probe Disconnected.;;;;;;;;;;;;;;;;;;;;;;;
emsSensorConnected;.1.3.6.1.4.1.318.0.234;Energia;2;Normal;Sensor Connected.;;;;;;;;;;;;;;;;;;;;;;;
emsSensorDisconnected;.1.3.6.1.4.1.318.0.235;Energia;2;Normal;Sensor Disconnected.;;;;;;;;;;;;;;;;;;;;;;;
emsSensorFault;.1.3.6.1.4.1.318.0.236;Energia;2;Normal;Sensor Fault.;;;;;;;;;;;;;;;;;;;;;;;
emsSensorFaultCleared;.1.3.6.1.4.1.318.0.237;Energia;2;Normal;Sensor Fault Cleared.;;;;;;;;;;;;;;;;;;;;;;;
emsBeaconConnected;.1.3.6.1.4.1.318.0.238;Energia;2;Normal;Beacon Connected.;;;;;;;;;;;;;;;;;;;;;;;
emsBeaconDisconnected;.1.3.6.1.4.1.318.0.239;Energia;2;Normal;Beacon Disconnected.;;;;;;;;;;;;;;;;;;;;;;;
emsBeaconOn;.1.3.6.1.4.1.318.0.240;Energia;2;Normal;Beacon On.;;;;;;;;;;;;;;;;;;;;;;;
emsBeaconOff;.1.3.6.1.4.1.318.0.241;Energia;2;Normal;Beacon Off.;;;;;;;;;;;;;;;;;;;;;;;
emsMajorAlarm;.1.3.6.1.4.1.318.0.242;Energia;2;Normal;Major Alarm.;;;;;;;;;;;;;;;;;;;;;;;
emsMajorAlarmCleared;.1.3.6.1.4.1.318.0.243;Energia;2;Normal;Major Alarm Cleared.;;;;;;;;;;;;;;;;;;;;;;;
emsMinorAlarm;.1.3.6.1.4.1.318.0.244;Energia;2;Normal;Minor Alarm.;;;;;;;;;;;;;;;;;;;;;;;
emsMinorAlarmCleared;.1.3.6.1.4.1.318.0.245;Energia;2;Normal;Minor Alarm Cleared.;;;;;;;;;;;;;;;;;;;;;;;
emsOutletStateAbnormal;.1.3.6.1.4.1.318.0.246;Energia;2;Warning;Outlet has changed to its abnormal state.;;;;;;;;;;;;;;;;;;;;;;;
emsOutletStateNormal;.1.3.6.1.4.1.318.0.247;Energia;2;Normal;Outlet has changed to its normal state.;;;;;;;;;;;;;;;;;;;;;;;
emsInputContactStateAbnormal;.1.3.6.1.4.1.318.0.248;Energia;2;Warning;Input contact has changed to its abnormal state.;;;;;;;;;;;;;;;;;;;;;;;
emsInputContactStateNormal;.1.3.6.1.4.1.318.0.249;Energia;2;Normal;Input contact has changed to its normal state.;;;;;;;;;;;;;;;;;;;;;;;
emsOutputRelayStateAbnormal;.1.3.6.1.4.1.318.0.250;Energia;2;Warning;Output Relay has changed to its abnormal state.;;;;;;;;;;;;;;;;;;;;;;;
emsOutputRelayStateNormal;.1.3.6.1.4.1.318.0.251;Energia;2;Normal;Output Relay has changed to its normal state.;;;;;;;;;;;;;;;;;;;;;;;
emsDeviceConfigChange;.1.3.6.1.4.1.318.0.252;Energia;2;Normal;A device configuration change has been made on a EMS.;;;;;;;;;;;;;;;;;;;;;;;
envHighTempThresholdViolation;.1.3.6.1.4.1.318.0.253;Energia;2;Normal;High temperature threshold violation.;;;;;;;;;;;;;;;;;;;;;;;
envHighTempThresholdViolationCleared;.1.3.6.1.4.1.318.0.254;Energia;2;Normal;High temperature threshold violation cleared.;;;;;;;;;;;;;;;;;;;;;;;
envLowTempThresholdViolation;.1.3.6.1.4.1.318.0.255;Energia;2;Normal;Low temperature threshold violation.;;;;;;;;;;;;;;;;;;;;;;;
envLowTempThresholdViolationCleared;.1.3.6.1.4.1.318.0.256;Energia;2;Normal;Low temperature threshold violation cleared.;;;;;;;;;;;;;;;;;;;;;;;
envHighHumidityThresholdViolation;.1.3.6.1.4.1.318.0.257;Energia;2;Normal;High humidity threshold violation.;;;;;;;;;;;;;;;;;;;;;;;
envHighHumidityThresholdViolationCleared;.1.3.6.1.4.1.318.0.258;Energia;2;Normal;High humidity threshold violation cleared.;;;;;;;;;;;;;;;;;;;;;;;
envLowHumidityThresholdViolation;.1.3.6.1.4.1.318.0.259;Energia;2;Normal;Low humidity threshold violation.;;;;;;;;;;;;;;;;;;;;;;;
envLowHumidityThresholdViolationCleared;.1.3.6.1.4.1.318.0.260;Energia;2;Normal;Low humidity threshold violation cleared.;;;;;;;;;;;;;;;;;;;;;;;
rPDUCommunicationEstablished;.1.3.6.1.4.1.318.0.266;Energia;2;Normal;Communication with a Rack PDU established.;;;;;;;;;;;;;;;;;;;;;;;
rPDUCommunicationLost;.1.3.6.1.4.1.318.0.267;Energia;2;Normal;Communication with a Rack PDU has been lost.;;;;;;;;;;;;;;;;;;;;;;;
rPDUOutletOn;.1.3.6.1.4.1.318.0.268;Energia;2;Normal;An outlet on a Switched Rack PDU has turned on.;;;;;;;;;;;;;;;;;;;;;;;
rPDUOutletOff;.1.3.6.1.4.1.318.0.269;Energia;2;Normal;An outlet on a Switched Rack PDU has turned off.;;;;;;;;;;;;;;;;;;;;;;;
rPDUDeviceConfigChange;.1.3.6.1.4.1.318.0.270;Energia;2;Normal;Device configuration change has been made on a Rack PDU.;;;;;;;;;;;;;;;;;;;;;;;
rPDUOutletConfigChange;.1.3.6.1.4.1.318.0.271;Energia;2;Normal;Outlet configuration change has been made on a Switched Rack PDU.;;;;;;;;;;;;;;;;;;;;;;;
rPDULowLoad;.1.3.6.1.4.1.318.0.272;Energia;2;Warning;A Rack PDU has violated the low load threshold.;;;;;;;;;;;;;;;;;;;;;;;
rPDULowLoadCleared;.1.3.6.1.4.1.318.0.273;Energia;2;Normal;The low load condition on a Rack PDU has been cleared.;;;;;;;;;;;;;;;;;;;;;;;
rPDUNearOverload;.1.3.6.1.4.1.318.0.274;Energia;2;Warning;A Rack PDU is near an overload condition.;;;;;;;;;;;;;;;;;;;;;;;
rPDUNearOverloadCleared;.1.3.6.1.4.1.318.0.275;Energia;2;Normal;Rack PDU near overload condition has cleared.;;;;;;;;;;;;;;;;;;;;;;;
rPDUOverload;.1.3.6.1.4.1.318.0.276;Energia;2;Normal;A Rack PDU is in an overload condition.;;;;;;;;;;;;;;;;;;;;;;;
rPDUOverloadCleared;.1.3.6.1.4.1.318.0.277;Energia;2;Normal;The overload condition on a Rack PDU has cleared.;;;;;;;;;;;;;;;;;;;;;;;
rPDUPowerSupply1Fail;.1.3.6.1.4.1.318.0.278;Energia;2;Normal;Power Supply 1 on Rack PDU is in FAIL state.;;;;;;;;;;;;;;;;;;;;;;;
rPDUPowerSupply1Ok;.1.3.6.1.4.1.318.0.279;Energia;2;Normal;Power Supply 1 on Rack PDU is operating normally.;;;;;;;;;;;;;;;;;;;;;;;
rPDUPowerSupply2Fail;.1.3.6.1.4.1.318.0.280;Energia;2;Normal;Power Supply 2 on Rack PDU is in FAIL state.;;;;;;;;;;;;;;;;;;;;;;;
rPDUPowerSupply2Ok;.1.3.6.1.4.1.318.0.281;Energia;2;Normal;Power Supply 2 on Rack PDU is operating normally.;;;;;;;;;;;;;;;;;;;;;;;
rPDUPhaseConfigChange;.1.3.6.1.4.1.318.0.282;Energia;2;Normal;Phase configuration change has been made on a Rack PDU.;;;;;;;;;;;;;;;;;;;;;;;
rPDUCancelPendingCommand;.1.3.6.1.4.1.318.0.283;Energia;2;Normal;A Cancel Pending Command has been made on a Switched Rack PDU.;;;;;;;;;;;;;;;;;;;;;;;
aruAlinkCommunicationEstablished;.1.3.6.1.4.1.318.0.284;Energia;2;Normal;Communication Established.;;;;;;;;;;;;;;;;;;;;;;;
aruAlinkCommunicationLost;.1.3.6.1.4.1.318.0.285;Energia;2;Normal;Communication Lost.;;;;;;;;;;;;;;;;;;;;;;;
aruFanFail;.1.3.6.1.4.1.318.0.286;Energia;2;Normal;Fan Fail.;;;;;;;;;;;;;;;;;;;;;;;
aruFanFailCleared;.1.3.6.1.4.1.318.0.287;Energia;2;Normal;Fan Fail Cleared.;;;;;;;;;;;;;;;;;;;;;;;
aruSmokeAlarm;.1.3.6.1.4.1.318.0.288;Energia;2;Normal;Smoke Alarm.;;;;;;;;;;;;;;;;;;;;;;;
aruSmokeAlarmCleared;.1.3.6.1.4.1.318.0.289;Energia;2;Normal;Smoke Alarm Cleared.;;;;;;;;;;;;;;;;;;;;;;;
aruHighTemperatureAlarm;.1.3.6.1.4.1.318.0.290;Energia;2;Warning;High Temperature Alarm.;;;;;;;;;;;;;;;;;;;;;;;
aruHighTemperatureAlarmCleared;.1.3.6.1.4.1.318.0.291;Energia;2;Normal;High Temperature Alarm Cleared.;;;;;;;;;;;;;;;;;;;;;;;
aruExhaustTemperatureAlarm;.1.3.6.1.4.1.318.0.292;Energia;2;Normal;Exhaust Temperature Alarm.;;;;;;;;;;;;;;;;;;;;;;;
aruExhaustTemperatureAlarmCleared;.1.3.6.1.4.1.318.0.293;Energia;2;Normal;Exhaust Temperature Alarm Cleared.;;;;;;;;;;;;;;;;;;;;;;;
envAlinkCommunicationEstablished;.1.3.6.1.4.1.318.0.294;Energia;2;Normal;Communication Established.;;;;;;;;;;;;;;;;;;;;;;;
envAlinkCommunicationLost;.1.3.6.1.4.1.318.0.295;Energia;2;Normal;Communication Lost.;;;;;;;;;;;;;;;;;;;;;;;
emsAlinkPowerOverload;.1.3.6.1.4.1.318.0.296;Energia;2;Normal;Alink Power Overload.;;;;;;;;;;;;;;;;;;;;;;;
emsAlinkPowerOverloadCleared;.1.3.6.1.4.1.318.0.297;Energia;2;Normal;Alink Power Overload Cleared.;;;;;;;;;;;;;;;;;;;;;;;
upsOutletGroupTurnedOn;.1.3.6.1.4.1.318.0.298;Energia;2;Normal;Outlet Group turned on;;;;;;;;;;;;;;;;;;;;;;;
upsOutletGroupTurnedOff;.1.3.6.1.4.1.318.0.299;Energia;2;Warning;Outlet Group turned off.;;;;;;;;;;;;;;;;;;;;;;;
smwCriticalCondition;.1.3.6.1.4.1.318.0.300;Energia;2;Normal;A critical condition has been detected.;;;;;;;;;;;;;;;;;;;;;;;
smwCriticalConditionCleared;.1.3.6.1.4.1.318.0.301;Energia;2;Normal;A critical condition has been cleared.;;;;;;;;;;;;;;;;;;;;;;;
smwWarningCondition;.1.3.6.1.4.1.318.0.302;Energia;2;Warning;A warning condition has been detected.;;;;;;;;;;;;;;;;;;;;;;;
smwWarningConditionCleared;.1.3.6.1.4.1.318.0.303;Energia;2;Normal;A warning condition has been cleared.;;;;;;;;;;;;;;;;;;;;;;;
smwInformationalCondition;.1.3.6.1.4.1.318.0.304;Energia;2;Normal;An informational condition has been detected.;;;;;;;;;;;;;;;;;;;;;;;
smwInformationalConditionCleared;.1.3.6.1.4.1.318.0.305;Energia;2;Normal;An informational condition has been cleared.;;;;;;;;;;;;;;;;;;;;;;;
airCriticalCondition;.1.3.6.1.4.1.318.0.306;Energia;2;Normal;A critical condition was detected.;;;;;;;;;;;;;;;;;;;;;;;
airCriticalConditionCleared;.1.3.6.1.4.1.318.0.307;Energia;2;Normal;A critical condition was cleared.;;;;;;;;;;;;;;;;;;;;;;;
airWarningCondition;.1.3.6.1.4.1.318.0.308;Energia;2;Warning;A warning condition was detected.;;;;;;;;;;;;;;;;;;;;;;;
airWarningConditionCleared;.1.3.6.1.4.1.318.0.309;Energia;2;Normal;A warning condition was cleared.;;;;;;;;;;;;;;;;;;;;;;;
airInformationalCondition;.1.3.6.1.4.1.318.0.310;Energia;2;Normal;An informational condition was detected.;;;;;;;;;;;;;;;;;;;;;;;
airInformationalConditionCleared;.1.3.6.1.4.1.318.0.311;Energia;2;Normal;An informational condition was cleared.;;;;;;;;;;;;;;;;;;;;;;;
xPDUInputVoltageLowAlarm;.1.3.6.1.4.1.318.0.312;Energia;2;Normal;Input voltage is below threshold.;;;;;;;;;;;;;;;;;;;;;;;
xPDUInputVoltageLowAlarmCleared;.1.3.6.1.4.1.318.0.313;Energia;2;Normal;Main input low voltage cleared.;;;;;;;;;;;;;;;;;;;;;;;
xPDUInputVoltageHighAlarm;.1.3.6.1.4.1.318.0.314;Energia;2;Normal;Main input voltage is above threshold.;;;;;;;;;;;;;;;;;;;;;;;
xPDUInputVoltageHighAlarmCleared;.1.3.6.1.4.1.318.0.315;Energia;2;Normal;Main input high voltage alarm cleared.;;;;;;;;;;;;;;;;;;;;;;;
xPDUBypassVoltageLowAlarm;.1.3.6.1.4.1.318.0.316;Energia;2;Normal;Bypass input voltage is below threshold.;;;;;;;;;;;;;;;;;;;;;;;
xPDUBypassVoltageLowAlarmCleared;.1.3.6.1.4.1.318.0.317;Energia;2;Normal;Bypass input low voltage alarm cleared.;;;;;;;;;;;;;;;;;;;;;;;
xPDUBypassVoltageHighAlarm;.1.3.6.1.4.1.318.0.318;Energia;2;Normal;Bypass input voltage is above threshold.;;;;;;;;;;;;;;;;;;;;;;;
xPDUBypassVoltageHighAlarmCleared;.1.3.6.1.4.1.318.0.319;Energia;2;Normal;Bypass input voltage alarm cleared.;;;;;;;;;;;;;;;;;;;;;;;
xPDUOutputVoltageLowAlarm;.1.3.6.1.4.1.318.0.320;Energia;2;Normal;Output voltage is below threshold.;;;;;;;;;;;;;;;;;;;;;;;
xPDUOutputVoltageLowAlarmCleared;.1.3.6.1.4.1.318.0.321;Energia;2;Normal;Output low voltage alarm cleared.;;;;;;;;;;;;;;;;;;;;;;;
xPDUOutputVoltageHighAlarm;.1.3.6.1.4.1.318.0.322;Energia;2;Normal;Output voltage is above threshold.;;;;;;;;;;;;;;;;;;;;;;;
xPDUOutputVoltageHighAlarmCleared;.1.3.6.1.4.1.318.0.323;Energia;2;Normal;Output high voltage alarm cleared.;;;;;;;;;;;;;;;;;;;;;;;
xPDUOutputCurrentLowAlarm;.1.3.6.1.4.1.318.0.324;Energia;2;Normal;Output current is below threshold.;;;;;;;;;;;;;;;;;;;;;;;
xPDUOutputCurrentLowAlarmCleared;.1.3.6.1.4.1.318.0.325;Energia;2;Normal;Output low current alarm cleared.;;;;;;;;;;;;;;;;;;;;;;;
xPDUOutputCurrentHighAlarm;.1.3.6.1.4.1.318.0.326;Energia;2;Normal;Output current is above threshold.;;;;;;;;;;;;;;;;;;;;;;;
xPDUOutputCurrentHighAlarmCleared;.1.3.6.1.4.1.318.0.327;Energia;2;Normal;Output high current alarm cleared.;;;;;;;;;;;;;;;;;;;;;;;
xPDUOutputFrequencyAlarm;.1.3.6.1.4.1.318.0.328;Energia;2;Normal;Output frequency is outofrange.;;;;;;;;;;;;;;;;;;;;;;;
xPDUOutputFrequencyAlarmCleared;.1.3.6.1.4.1.318.0.329;Energia;2;Normal;Output frequency in range.;;;;;;;;;;;;;;;;;;;;;;;
xPDUSystemGroundCurrentAlarm;.1.3.6.1.4.1.318.0.330;Energia;2;Normal;Earth ground current is above threshold.;;;;;;;;;;;;;;;;;;;;;;;
xPDUSystemGroundCurrentAlarmCleared;.1.3.6.1.4.1.318.0.331;Energia;2;Normal;Earth ground high current alarm cleared.;;;;;;;;;;;;;;;;;;;;;;;
xPDUInputContactStateAbnormal;.1.3.6.1.4.1.318.0.332;Energia;2;Normal;Input contact has changed to its abnormal state.;;;;;;;;;;;;;;;;;;;;;;;
xPDUInputContactStateNormal;.1.3.6.1.4.1.318.0.333;Energia;2;Normal;Input contact has changed to its normal state.;;;;;;;;;;;;;;;;;;;;;;;
xPDUOutputNeutralCurrentHighAlarm;.1.3.6.1.4.1.318.0.334;Energia;2;Warning;Output neutral current is above threshold.;;;;;;;;;;;;;;;;;;;;;;;
xPDUOutputNeutralCurrentHighAlarmCleared;.1.3.6.1.4.1.318.0.335;Energia;2;Normal;Output neutral high current alarm cleared.;;;;;;;;;;;;;;;;;;;;;;;
xPDUCoolingFanAlarm;.1.3.6.1.4.1.318.0.336;Energia;2;Normal;Cooling fan failure.;;;;;;;;;;;;;;;;;;;;;;;
xPDUCoolingFanAlarmCleared;.1.3.6.1.4.1.318.0.337;Energia;2;Normal;Cooling fan alarm cleared.;;;;;;;;;;;;;;;;;;;;;;;
xPDUTransformerTempAlarm;.1.3.6.1.4.1.318.0.338;Energia;2;Normal;Transformer temp alarm.;;;;;;;;;;;;;;;;;;;;;;;
xPDUTransformerTempAlarmCleared;.1.3.6.1.4.1.318.0.339;Energia;2;Normal;Transformer temp alarm cleared.;;;;;;;;;;;;;;;;;;;;;;;
xPDUBranchCurrentLowAlarm;.1.3.6.1.4.1.318.0.340;Energia;2;Warning;Branch circuit current is below threshold.;;;;;;;;;;;;;;;;;;;;;;;
xPDUBranchCurrentLowAlarmCleared;.1.3.6.1.4.1.318.0.341;Energia;2;Normal;Branch circuit low current alarm cleared.;;;;;;;;;;;;;;;;;;;;;;;
xPDUBranchCurrentHighAlarm;.1.3.6.1.4.1.318.0.342;Energia;2;Warning;Branch circuit current is above threshold.;;;;;;;;;;;;;;;;;;;;;;;
xPDUBranchCurrentHighAlarmCleared;.1.3.6.1.4.1.318.0.343;Energia;2;Normal;Branch circuit high current alarm cleared.;;;;;;;;;;;;;;;;;;;;;;;
xPDUInternalCommError;.1.3.6.1.4.1.318.0.344;Energia;2;Normal;Internal communication error.;;;;;;;;;;;;;;;;;;;;;;;
emsHardwareStateAbnormal;.1.3.6.1.4.1.318.0.345;Energia;2;Normal;Hardware is in an abnormal state.;;;;;;;;;;;;;;;;;;;;;;;
emsHardwareStateNormal;.1.3.6.1.4.1.318.0.346;Energia;2;Normal;Hardware is in its normal state.;;;;;;;;;;;;;;;;;;;;;;;
ceSevereCondition;.1.3.6.1.4.1.318.0.347;Energia;2;Normal;A severe condition was detected.;;;;;;;;;;;;;;;;;;;;;;;
ceSevereConditionCleared;.1.3.6.1.4.1.318.0.348;Energia;2;Normal;A severe condition was cleared.;;;;;;;;;;;;;;;;;;;;;;;
ceWarningCondition;.1.3.6.1.4.1.318.0.349;Energia;2;Warning;A warning condition was detected.;;;;;;;;;;;;;;;;;;;;;;;
ceWarningConditionCleared;.1.3.6.1.4.1.318.0.350;Energia;2;Normal;A warning condition was cleared.;;;;;;;;;;;;;;;;;;;;;;;
ceInformationalCondition;.1.3.6.1.4.1.318.0.351;Energia;2;Normal;An informational condition was detected.;;;;;;;;;;;;;;;;;;;;;;;
ceInformationalConditionCleared;.1.3.6.1.4.1.318.0.352;Energia;2;Normal;An informational condition was cleared.;;;;;;;;;;;;;;;;;;;;;;;
upsInternalOverTemperature;.1.3.6.1.4.1.318.0.353;Energia;2;Warning;The internal over temperature condition exists.;;;;;;;;;;;;;;;;;;;;;;;
upsInternalOverTemperatureCleared;.1.3.6.1.4.1.318.0.354;Energia;2;Normal;The internal over temperature condition cleared.;;;;;;;;;;;;;;;;;;;;;;;
upsMpuReset;.1.3.6.1.4.1.318.0.355;Energia;2;Normal;The MPU has been reset.;;;;;;;;;;;;;;;;;;;;;;;
upsOutputSwitchClosed;.1.3.6.1.4.1.318.0.356;Energia;2;Normal;The Output Switch is closed.;;;;;;;;;;;;;;;;;;;;;;;
upsOutputSwitchOpened;.1.3.6.1.4.1.318.0.357;Energia;2;Normal;The Output Switch is open.;;;;;;;;;;;;;;;;;;;;;;;
upsCalibrationStackChanged;.1.3.6.1.4.1.318.0.358;Energia;2;Normal;A calibration value in the stack was changed.;;;;;;;;;;;;;;;;;;;;;;;
envMaxTempThresholdViolation;.1.3.6.1.4.1.318.0.359;Energia;2;Normal;Max temperature threshold violation.;;;;;;;;;;;;;;;;;;;;;;;
envMaxTempThresholdViolationCleared;.1.3.6.1.4.1.318.0.360;Energia;2;Normal;Max temperature threshold violation cleared.;;;;;;;;;;;;;;;;;;;;;;;
envMinTempThresholdViolation;.1.3.6.1.4.1.318.0.361;Energia;2;Normal;Min temperature threshold violation.;;;;;;;;;;;;;;;;;;;;;;;
envMinTempThresholdViolationCleared;.1.3.6.1.4.1.318.0.362;Energia;2;Normal;Min temperature threshold violation cleared.;;;;;;;;;;;;;;;;;;;;;;;
envMaxHumidityThresholdViolation;.1.3.6.1.4.1.318.0.363;Energia;2;Normal;Max humidity threshold violation.;;;;;;;;;;;;;;;;;;;;;;;
envMaxHumidityThresholdViolationCleared;.1.3.6.1.4.1.318.0.364;Energia;2;Normal;Max humidity threshold violation cleared.;;;;;;;;;;;;;;;;;;;;;;;
envMinHumidityThresholdViolation;.1.3.6.1.4.1.318.0.365;Energia;2;Normal;Min humidity threshold violation.;;;;;;;;;;;;;;;;;;;;;;;
envMinHumidityThresholdViolationCleared;.1.3.6.1.4.1.318.0.366;Energia;2;Normal;Min humidity threshold violation cleared.;;;;;;;;;;;;;;;;;;;;;;;
envSTIncTempRateViolation;.1.3.6.1.4.1.318.0.367;Energia;2;Normal;Shortterm inc. temp rate violation.;;;;;;;;;;;;;;;;;;;;;;;
envSTIncTempRateViolationCleared;.1.3.6.1.4.1.318.0.368;Energia;2;Normal;Shortterm inc. temp rate violation cleared.;;;;;;;;;;;;;;;;;;;;;;;
envSTDecTempRateViolation;.1.3.6.1.4.1.318.0.369;Energia;2;Normal;Shortterm dec. temp rate violation.;;;;;;;;;;;;;;;;;;;;;;;
envSTDecTempRateViolationCleared;.1.3.6.1.4.1.318.0.370;Energia;2;Normal;Shortterm dec. temp rate violation cleared.;;;;;;;;;;;;;;;;;;;;;;;
envLTIncTempRateViolation;.1.3.6.1.4.1.318.0.371;Energia;2;Normal;Longterm inc. temp rate violation.;;;;;;;;;;;;;;;;;;;;;;;
envLTIncTempRateViolationCleared;.1.3.6.1.4.1.318.0.372;Energia;2;Normal;Longterm inc. temp rate violation cleared.;;;;;;;;;;;;;;;;;;;;;;;
envLTDecTempRateViolation;.1.3.6.1.4.1.318.0.373;Energia;2;Normal;Longterm dec. temp rate violation.;;;;;;;;;;;;;;;;;;;;;;;
envLTDecTempRateViolationCleared;.1.3.6.1.4.1.318.0.374;Energia;2;Normal;Longterm dec. temp rate violation cleared.;;;;;;;;;;;;;;;;;;;;;;;
bmsCriticalCondition;.1.3.6.1.4.1.318.0.375;Energia;2;Normal;A critical condition was detected.;;;;;;;;;;;;;;;;;;;;;;;
bmsCriticalConditionCleared;.1.3.6.1.4.1.318.0.376;Energia;2;Normal;A critical condition was cleared.;;;;;;;;;;;;;;;;;;;;;;;
bmsWarningCondition;.1.3.6.1.4.1.318.0.377;Energia;2;Warning;A warning condition was detected.;;;;;;;;;;;;;;;;;;;;;;;
bmsWarningConditionCleared;.1.3.6.1.4.1.318.0.378;Energia;2;Normal;A warning condition was cleared.;;;;;;;;;;;;;;;;;;;;;;;
bmsInformationalCondition;.1.3.6.1.4.1.318.0.379;Energia;2;Normal;An informational condition was detected.;;;;;;;;;;;;;;;;;;;;;;;
bmsInformationalConditionCleared;.1.3.6.1.4.1.318.0.380;Energia;2;Normal;An informational condition was cleared.;;;;;;;;;;;;;;;;;;;;;;;
xATSOutputVoltageLowAlarm;.1.3.6.1.4.1.318.0.381;Energia;2;Normal;Output voltage is below threshold.;;;;;;;;;;;;;;;;;;;;;;;
xATSOutputVoltageLowAlarmCleared;.1.3.6.1.4.1.318.0.382;Energia;2;Normal;Output low voltage alarm cleared.;;;;;;;;;;;;;;;;;;;;;;;
xATSOutputVoltageHighAlarm;.1.3.6.1.4.1.318.0.383;Energia;2;Normal;Output voltage is above threshold.;;;;;;;;;;;;;;;;;;;;;;;
xATSOutputVoltageHighAlarmCleared;.1.3.6.1.4.1.318.0.384;Energia;2;Normal;Output high voltage alarm cleared.;;;;;;;;;;;;;;;;;;;;;;;
xATSOutputCurrentLowAlarm;.1.3.6.1.4.1.318.0.385;Energia;2;Normal;Output current is below threshold.;;;;;;;;;;;;;;;;;;;;;;;
xATSOutputCurrentLowAlarmCleared;.1.3.6.1.4.1.318.0.386;Energia;2;Normal;Output low current alarm cleared.;;;;;;;;;;;;;;;;;;;;;;;
xATSOutputCurrentHighAlarm;.1.3.6.1.4.1.318.0.387;Energia;2;Normal;Output current is above threshold.;;;;;;;;;;;;;;;;;;;;;;;
xATSOutputCurrentHighAlarmCleared;.1.3.6.1.4.1.318.0.388;Energia;2;Normal;Output high current alarm cleared.;;;;;;;;;;;;;;;;;;;;;;;
xATSOutputFrequencyAlarm;.1.3.6.1.4.1.318.0.389;Energia;2;Normal;Output frequency is outofrange.;;;;;;;;;;;;;;;;;;;;;;;
xATSOutputFrequencyAlarmCleared;.1.3.6.1.4.1.318.0.390;Energia;2;Normal;Output frequency in range.;;;;;;;;;;;;;;;;;;;;;;;
xATSInternalCommError;.1.3.6.1.4.1.318.0.391;Energia;2;Normal;Internal communication error.;;;;;;;;;;;;;;;;;;;;;;;
xATSInternalCommErrorCleared;.1.3.6.1.4.1.318.0.392;Energia;2;Normal;ATS Communication error cleared.;;;;;;;;;;;;;;;;;;;;;;;
xATSDataCommMismatchError;.1.3.6.1.4.1.318.0.393;Energia;2;Normal;ATS data mismatch error.;;;;;;;;;;;;;;;;;;;;;;;
xATSDataCommMismatchErrorCleared;.1.3.6.1.4.1.318.0.394;Energia;2;Normal;ATS data mismatch error cleared.;;;;;;;;;;;;;;;;;;;;;;;
xATSGenCommLost;.1.3.6.1.4.1.318.0.395;Energia;2;Warning;ATS/Generator communication lost.;;;;;;;;;;;;;;;;;;;;;;;
xATSGenCommEstablished;.1.3.6.1.4.1.318.0.396;Energia;2;Normal;ATS/generator communication established.;;;;;;;;;;;;;;;;;;;;;;;
xATSNeutralPosition;.1.3.6.1.4.1.318.0.397;Energia;2;Warning;Transferred to neutral.;;;;;;;;;;;;;;;;;;;;;;;
xATSSwitchTransferEvent;.1.3.6.1.4.1.318.0.398;Energia;2;Normal;SourcetoSource transfer.;;;;;;;;;;;;;;;;;;;;;;;
xATSInternalATSFault;.1.3.6.1.4.1.318.0.399;Energia;2;Normal;ATS internal fault detected.;;;;;;;;;;;;;;;;;;;;;;;
xATSInternalATSFaultCleared;.1.3.6.1.4.1.318.0.400;Energia;2;Normal;ATS internal fault cleared.;;;;;;;;;;;;;;;;;;;;;;;
xATSEngineStartAsserted;.1.3.6.1.4.1.318.0.401;Energia;2;Normal;Engine Start asserted.;;;;;;;;;;;;;;;;;;;;;;;
xATSEngineStopAsserted;.1.3.6.1.4.1.318.0.402;Energia;2;Normal;Engine Stop asserted.;;;;;;;;;;;;;;;;;;;;;;;
xATSStartFailure;.1.3.6.1.4.1.318.0.403;Energia;2;Normal;Generator failed to start.;;;;;;;;;;;;;;;;;;;;;;;
xATSStopFailure;.1.3.6.1.4.1.318.0.404;Energia;2;Warning;Generator failed to stop.;;;;;;;;;;;;;;;;;;;;;;;
xATSNotInAutomaticMode;.1.3.6.1.4.1.318.0.405;Energia;2;Normal;ATS not in auto.;;;;;;;;;;;;;;;;;;;;;;;
xATSNotInAutomaticModeCleared;.1.3.6.1.4.1.318.0.406;Energia;2;Normal;ATS in auto mode.;;;;;;;;;;;;;;;;;;;;;;;
xATSEpoTripped;.1.3.6.1.4.1.318.0.407;Energia;2;Normal;EPO tripped.;;;;;;;;;;;;;;;;;;;;;;;
xATSEpoReset;.1.3.6.1.4.1.318.0.408;Energia;2;Normal;EPO armed.;;;;;;;;;;;;;;;;;;;;;;;
xATSEpoTestMode;.1.3.6.1.4.1.318.0.409;Energia;2;Warning;EPO disabled.;;;;;;;;;;;;;;;;;;;;;;;
xATSEpoArmed;.1.3.6.1.4.1.318.0.410;Energia;2;Normal;EPO armed.;;;;;;;;;;;;;;;;;;;;;;;
xATSTestInitiated;.1.3.6.1.4.1.318.0.411;Energia;2;Normal;Test initiated.;;;;;;;;;;;;;;;;;;;;;;;
xATSTestCanceled;.1.3.6.1.4.1.318.0.412;Energia;2;Normal;Test canceled.;;;;;;;;;;;;;;;;;;;;;;;
xATSTestFailed;.1.3.6.1.4.1.318.0.413;Energia;2;Normal;Initiated test failed.;;;;;;;;;;;;;;;;;;;;;;;
xATSTestPassed;.1.3.6.1.4.1.318.0.414;Energia;2;Normal;Initiated test passed.;;;;;;;;;;;;;;;;;;;;;;;
xATSInputContactStateAbnormal;.1.3.6.1.4.1.318.0.415;Energia;2;Normal;Input contact has changed to its abnormal state.;;;;;;;;;;;;;;;;;;;;;;;
xATSInputContactStateNormal;.1.3.6.1.4.1.318.0.416;Energia;2;Normal;Input contact has changed to its normal state.;;;;;;;;;;;;;;;;;;;;;;;
